DOI,../extracted_csv/paper_poci.csv,../extracted_csv/paper_openalex.csv,../extracted_csv/paper_dimensions.csv,../extracted_csv/paper_coci.csv
NAS-Unet: Neural Architecture Search for Medical Image Segmentation,False,True,True,True
Reducing the Hausdorff Distance in Medical Image Segmentation With Convolutional Neural Networks,False,False,True,True
A new era: artificial intelligence and machine learning in prostate cancer,False,True,True,True
Computer-Aided Detection and diagnosis for prostate cancer based on mono and multi-parametric MRI: A review,False,False,True,True
Cloud-Based Evaluation of Anatomical Structure Segmentation and Landmark Detection Algorithms: VISCERAL Anatomy Benchmarks,False,True,True,True
MS-Net: Multi-Site Network for Improving Prostate Segmentation With Heterogeneous MRI Data,False,True,True,True
A survey on U-shaped networks in medical image segmentations,False,True,True,True
Deep Attentive Features for Prostate Segmentation in 3D Transrectal Ultrasound,False,True,True,True
Multiparametric MRI and radiomics in prostate cancer: a review,False,True,True,True
Atlas registration and ensemble deep convolutional neural network-based prostate segmentation using magnetic resonance imaging,False,True,True,True
AdaResU-Net: Multiobjective adaptive convolutional neural network for medical image segmentation,False,True,True,True
Prostate segmentation in MRI using a convolutional neural network architecture and training strategy based on statistical shape models,False,True,True,True
3D APA-Net: 3D Adversarial Pyramid Anisotropic Convolutional Network for Prostate Segmentation in MR Images,False,True,True,True
FedDG: Federated Domain Generalization on Medical Image Segmentation via Episodic Learning in Continuous Frequency Space,False,True,True,True
Fully automated segmentation of prostate whole gland and transition zone in diffusion-weighted MRI using convolutional neural networks.,False,True,False,False
Automatic Segmentation of the Prostate on CT Images Using Deep Neural Networks (DNN),False,True,True,True
Automated Prostate Gland Segmentation Based on an Unsupervised Fuzzy C-Means Clustering Technique Using Multispectral T1w and T2w MR Imaging,False,True,True,True
Joint optimization of segmentation and shape prior from level-set-based statistical shape model and its application to the automated segmentation of abdominal organs,False,True,True,True
Adversarial Deformation Regularization for Training Image Registration Neural Networks,False,True,True,True
Annotated normal CT data of the abdomen for deep learning: Challenges and strategies for implementation,False,True,True,True
Automatic segmentation approach to extracting neonatal cerebral ventricles from 3D ultrasound images,False,True,True,True
Inter-site Variability in Prostate Segmentation Accuracy Using Deep Learning,False,False,True,True
Intracranial volume normalization methods: Considerations when investigating gender differences in regional brain volume,False,True,True,True
Computer-aided detection of prostate cancer in T2-weighted MRI within the peripheral zone,False,True,True,True
Automatic prostate segmentation using deep learning on clinically diverse 3D transrectal ultrasound images,False,True,True,True
A comprehensive non-invasive framework for diagnosing prostate cancer,False,True,True,True
Radiomics and radiogenomics of prostate cancer,False,True,True,True
Automated segmentation of prostate zonal anatomy on T2‐weighted (T2W) and apparent diffusion coefficient ( <scp>ADC</scp> ) map <scp>MR</scp> images using U‐Nets,False,True,False,False
Automatic hip cartilage segmentation from 3D MR images using arc-weighted graph searching,False,True,True,True
A propagation-DNN: Deep combination learning of multi-level features for MR prostate segmentation,False,True,True,True
Variability of manual segmentation of the prostate in axial T2-weighted MRI: A multi-reader study,False,True,True,True
The use of atlas registration and graph cuts for prostate segmentation in magnetic resonance images,False,True,True,True
Medical image segmentation using deep learning: A survey,False,True,True,True
A 3D-2D Hybrid U-Net Convolutional Neural Network Approach to Prostate Organ Segmentation of Multiparametric MRI,False,True,False,True
Computer-aided diagnosis of clinically significant prostate cancer from MRI images using sparse autoencoder and random forest classifier,False,True,True,True
User-Guided Segmentation of Preterm Neonate Ventricular System from 3-D Ultrasound Images Using Convex Optimization,False,True,True,True
Deep Learning for Real-time Automatic and Scanner-adapted Prostate (Zone) Segmentation of Transrectal Ultrasound for Example Magnetic Resonance Imaging–transrectal Ultrasound Fusion Prostate Biopsy,False,True,False,True
Convolutional Neural Networks for Prostate Magnetic Resonance Image Segmentation,False,True,True,True
Prostate Segmentation Using Z-Net,False,True,True,True
Prostate lesion segmentation in MR images using radiomics based deeply supervised U-Net,False,True,True,True
MS-NAS: Multi-scale Neural Architecture Search for Medical Image Segmentation,False,True,True,True
MR and CT data with multiobserver delineations of organs in the pelvic area-Part of the Gold Atlas project,False,True,False,True
Brain tumor detection based on hybrid deep neural network in MRI by adaptive squirrel search optimization,False,True,True,True
SmartPaint: a tool for interactive segmentation of medical volume images,False,True,True,True
Automatic Magnetic Resonance Image Prostate Segmentation Based on Adaptive Feature Learning Probability Boosting Tree Initialization and CNN-ASM Refinement,False,True,True,True
CNN-Based Prostate Zonal Segmentation on T2-Weighted MR Images: A Cross-Dataset Study,False,True,True,False
Towards Patient-Individual PI-Rads v2 Sector Map: Cnn for Automatic Segmentation of Prostatic Zones From T2-Weighted MRI,False,True,True,True
Cascade Dense-Unet for Prostate Segmentation in MR Images,False,True,True,True
Hybrid descriptive‐inferential method for key feature selection in prostate cancer radiomics,False,True,True,True
Hierarchical prostate MRI segmentation via level set clustering with shape prior,False,True,True,True
Iterative Interaction Training for Segmentation Editing Networks,False,True,True,True
Visual Saliency Based Active Learning for Prostate MRI Segmentation,False,True,True,True
Prostate segmentation in transrectal ultrasound using magnetic resonance imaging priors,False,True,True,True
GAS: A genetic atlas selection strategy in multi-atlas segmentation framework,False,True,True,True
Anisotropic 3D Multi-Stream CNN for Accurate Prostate Segmentation from Multi-Planar MRI,False,True,True,True
Biomechanical modeling constrained surface-based image registration for prostate MR guided TRUS biopsy,False,True,False,True
3D MR ventricle segmentation in pre-term infants with post-hemorrhagic ventricle dilatation (PHVD) using multi-phase geodesic level-sets,False,True,True,True
Prostate segmentation in MR images using ensemble deep convolutional neural networks,False,True,False,True
Blurred trace infrared image segmentation based on template approach and immune factor,False,True,True,True
Deep Learning-Based Boundary Detection for Model-Based Segmentation with Application to MR Prostate Segmentation,False,True,True,True
Comparison of Prostate MRI Lesion Segmentation Agreement Between Multiple Radiologists and a Fully Automatic Deep Learning System,False,True,True,True
Deep reinforcement learning in computer vision: a comprehensive survey,False,True,True,True
Automatic prostate segmentation on MR images with deep network and graph model,False,True,False,True
Automatic high resolution segmentation of the prostate from multi-planar MRI,False,True,False,True
Radiomics: A New Biomedical Workflow to Create a Predictive Model,False,True,True,True
EIS-Net: Segmenting early infarct and scoring ASPECTS simultaneously on non-contrast CT of patients with acute ischemic stroke,False,True,True,True
Spatially varying accuracy and reproducibility of prostate segmentation in magnetic resonance images using manual and semiautomated methods,False,True,True,True
Comparative Local Quality Assessment of 3D Medical Image Segmentations with Focus on Statistical Shape Model-Based Algorithms,False,True,True,True
Fast automated segmentation of multiple objects via spatially weighted shape learning,False,True,True,True
Deep convolutional neural network for prostate MR segmentation,False,True,True,True
Prostate Segmentation using 2D Bridged U-net,False,True,True,True
Three-Dimensional Convolutional Neural Network for Prostate MRI Segmentation and Comparison of Prostate Volume Measurements by Use of Artificial Neural Network and Ellipsoid Formula,False,True,False,True
Superpixel-based deep convolutional neural networks and active contour model for automatic prostate segmentation on 3D MRI scans,False,True,True,True
PSP net-based automatic segmentation network model for prostate magnetic resonance imaging,False,True,True,True
Rotationally resliced 3D prostate TRUS segmentation using convex optimization with shape priors,False,True,True,True
Development and clinical implementation of SeedNet: A sliding-window convolutional neural network for radioactive seed identification in MRI-assisted radiosurgery (MARS),False,True,False,True
Constrained deep networks: Lagrangian optimization via Log-barrier extensions,False,True,False,False
Manual prostate cancer segmentation in MRI: interreader agreement and volumetric correlation with transperineal template core needle biopsy,False,True,True,True
EvoU-Net,False,True,True,True
Deep Learning in Radiation Oncology Treatment Planning for Prostate Cancer: A Systematic Review,False,True,True,True
Online Robust Projective Dictionary Learning: Shape Modeling for MR-TRUS Registration,False,True,True,True
Optimisation of 2D U-Net Model Components for Automatic Prostate Segmentation on MRI,False,True,True,True
Machine Segmentation of Pelvic Anatomy in MRI-Assisted Radiosurgery (MARS) for Prostate Cancer Brachytherapy,False,True,True,True
An Evolutionary DenseRes Deep Convolutional Neural Network for Medical Image Segmentation,False,True,True,True
Skin lesion segmentation with deep learning,False,True,True,True
Automatic segmentation of 3D prostate MR images with iterative localization refinement,False,True,True,True
Deeply learnt hashing forests for content based image retrieval in prostate MR images,False,True,True,True
Cloud Deployment of High-Resolution Medical Image Analysis With TOMAAT,False,True,True,True
Interactive medical image segmentation via a point-based interaction,False,True,True,True
Computer-aided diagnosis of prostate cancer using multiparametric MRI and clinical features: A patient-level classification framework,False,True,True,True
Federated Whole Prostate Segmentation in MRI with Personalized Neural Architectures,False,True,True,True
AUTOMATIC SEGMENTATION OF PELVIS FOR BRACHYTHERAPY OF PROSTATE,False,True,False,True
Longitudinal Analysis of Pre-Term Neonatal Cerebral Ventricles From 3D Ultrasound Images Using Spatial-Temporal Deformable Registration,False,True,True,True
Regression and statistical shape model based substitute CT generation for MRI alone external beam radiation therapy from standard clinical MRI sequences,False,True,True,True
Prostate Segmentation From 3D Mri Using A Two-Stage Model and Variable-Input Based Uncertainty Measure,False,True,True,True
Deep Dilated V-Net for 3D Volume Segmentation of Pancreas in CT images,False,True,True,False
Automated stroke lesion segmentation in non-contrast CT scans using dense multi-path contextual generative adversarial network,False,True,True,True
Deep Generative Model-Driven Multimodal Prostate Segmentation in Radiotherapy,False,True,True,True
SK-Unet: An Improved U-Net Model With Selective Kernel for the Segmentation of LGE Cardiac MR Images,False,True,True,True
Improving Prostate Whole Gland Segmentation In T2-Weighted MRI With Synthetically Generated Data,False,True,True,True
Recent Automatic Segmentation Algorithms of MRI Prostate Regions: A Review,False,True,True,True
Fully Automatic Multispectral MR Image Segmentation of Prostate Gland Based on the Fuzzy C-Means Clustering Algorithm,False,True,True,True
Prostate detection and segmentation based on convolutional neural network and topological derivative,False,True,False,True
Automatic prostate segmentation based on fusion between deep network and variational methods,False,True,False,True
3D multi-scale discriminative network with multi-directional edge loss for prostate zonal segmentation in bi-parametric MR images,False,True,True,True
Bounding Box Tightness Prior for Weakly Supervised Image Segmentation,False,True,True,True
Rotationally resliced 3D prostate segmentation of MR images using Bhattacharyya similarity and active band theory,False,True,True,True
Automatic MRI prostate segmentation using 3D deeply supervised FCN with concatenated atrous convolution,False,True,True,True
MR to ultrasound image registration with segmentation‐based learning for HDR prostate brachytherapy,False,True,True,True
Automatic segmentation of prostate magnetic resonance imaging using generative adversarial networks,False,True,False,True
Comprehensive Importance-Based Selective Regularization for Continual Segmentation Across Multiple Sites,False,True,True,True
Comprehensive autoencoder for prostate recognition on MR images,False,True,False,True
A multiresolution prostate representation for automatic segmentation in magnetic resonance images,False,True,True,True
Tele-Operated MRI-Guided Needle Insertion for Prostate Interventions,False,True,True,True
Classification before Segmentation: Improved U-Net Prostate Segmentation,False,True,True,True
Artiﬁcial intelligence in medicine: current state and main directions of development of the intellectual diagnostics,False,True,False,True
CDA-Net for Automatic Prostate Segmentation in MR Images,False,True,True,True
Mixup (Sample Pairing) Can Improve the Performance of Deep Segmentation Networks,False,True,True,True
Zonal Segmentation in Transrectal Ultrasound Images of the Prostate Through Deep Learning,False,True,True,True
Computer-aided diagnosis and decision-making system for medical data analysis: A case study on prostate MR images,False,True,True,True
Prostate Segmentation via Fusing the Nested-V-net3d and V-net2d,False,True,True,True
Active Contour Model in Deep Learning Era: A Revise and Review,False,True,True,True
V-Net Light - Parameter-Efficient 3-D Convolutional Neural Network for Prostate MRI Segmentation,False,True,True,True
Dual Focal Loss to address class imbalance in semantic segmentation,False,True,True,True
Unet based Xception Model for Prostate Cancer Segmentation from MRI Images,False,True,True,True
Domain Composition and Attention for Unseen-Domain Generalizable Medical Image Segmentation,False,True,True,False
Opportunities for image analysis in radiation oncology,False,True,True,True
A combinatorial Bayesian and Dirichlet model for prostate MR image segmentation using probabilistic image features,False,True,True,True
3D Prostate TRUS Segmentation Using Globally Optimized Volume-Preserving Prior,False,True,True,True
Landmark based prostate MRI segmentation via improved level set method,False,True,False,True
Automatic and interactive prostate segmentation in MRI using learned contexts on a sparse graph template,False,True,False,True
Interactive Medical Image Segmentation via Point-Based Interaction and  Sequential Patch Learning,False,True,True,False
Using a Conditional Generative Adversarial Network (cGAN) for Prostate Segmentation,False,True,True,True
Automatic brain extraction from 3D fetal MR image with deep learning-based multi-step framework,False,True,True,True
Applications of artificial intelligence in prostate cancer imaging,False,True,False,True
Automatic Prostate Cancer Detection On Multi-Parametric Mri With Hierarchical Weakly Supervised Learning,False,True,True,True
Fully automated detection of prostate transition zone tumors on T2‐weighted and apparent diffusion coefficient (ADC) map MR images using U‐Net ensemble,False,True,True,True
Combined model-based and deep learning-based automated 3D zonal segmentation of the prostate on T2-weighted MR images: clinical evaluation,False,True,True,True
H-ProSeg: Hybrid ultrasound prostate segmentation based on explainability-guided mathematical model,False,False,True,True
Prostate158 - An expert-annotated 3T MRI dataset and algorithm for prostate cancer detection,False,False,True,True
Prostate contours delineation using interactive directional active contours model and parametric shape prior model,False,True,True,True
3D prostate MR-TRUS non-rigid registration using dual optimization with volume-preserving constraint,False,True,True,True
Multi-task Shape Regression for Medical Image Segmentation,False,True,True,True
Segmentation of Prostate in Diffusion MR Images via Clustering,False,True,True,True
Automated Segmentation Based on Residual U-Net Model for MR Prostate Images,False,True,True,False
Medical Image Analysis with Semantic Segmentation and Active Learning,False,True,True,False
Feature-Based Deformable Registration Using Minimal Spanning Tree for Prostate MR Segmentation,False,True,True,True
Shape-aware Meta-learning for Generalizing Prostate MRI Segmentation to  Unseen Domains,False,True,True,False
Automatic Prostate Segmentation on 3D MRI Scans Using Convolutional Neural Networks with Residual Connections and Superpixels,False,True,True,True
Robust Resolution-Enhanced Prostate Segmentation in Magnetic Resonance and Ultrasound Images through Convolutional Neural Networks,False,True,True,True
FedDG: Federated Domain Generalization on Medical Image Segmentation via  Episodic Learning in Continuous Frequency Space,False,True,True,False
MRI Diffusion‐Weighted Imaging to Measure Infarct Volume: Assessment of Manual Segmentation Variability,False,True,True,True
MRI pulse sequence integration for deep‐learning‐based brain metastases segmentation,False,True,False,True
ProCDet: a new method for prostate cancer detection based on MR images,False,True,False,False
Self-supervised Multimodal Generalized Zero Shot Learning for Gleason Grading,False,True,True,True
Deep learning model for automatic prostate segmentation on bicentric T2w images with and without endorectal coil,False,True,True,True
Computer-aided segmentation on MRI for prostate radiotherapy Part I: Quantifying human interobserver variability of the prostate and organs at risk and its impact on radiation dosimetry,False,True,True,True
Prostate Segmentation via Dynamic Fusion Model,False,True,True,True
Multiscale transunet + + : dense hybrid U-Net with transformer for medical image segmentation,False,True,True,False
Medical image diagnosis of prostate tumor based on PSP-Net+VGG16 deep learning network,False,True,True,True
Adaptation of a Multi-Site Network to a New Clinical Site Via Batch-Normalization Similarity,False,True,True,True
Attention-Assisted Adversarial Model for Cerebrovascular Segmentation in 3D TOF-MRA Volumes,False,True,True,False
TFCNs: A CNN-Transformer Hybrid Network for Medical Image Segmentation,False,True,True,False
Personalized Retrogress-Resilient Federated Learning Toward Imbalanced Medical Data,False,True,True,False
Automatic Prostate Segmentation on MR Images Using Enhanced Holistically-Nested Networks,False,True,True,True
Scale Normalization Cascaded Dense-Unet for Prostate Segmentation in MR Images,False,True,True,True
MRI Pulse Sequence Integration for Deep-Learning Based Brain Metastasis  Segmentation,False,True,True,False
3D Fully Convolutional Network Incorporating Savitzky-Golay Filtering for Prostate Segmentation,False,True,True,True
Attention deep residual networks for MR image analysis,False,True,True,True
MS-NAS: Multi-Scale Neural Architecture Search for Medical Image  Segmentation,False,True,True,False
Prospect and adversity of artificial intelligence in urology,False,True,False,True
A new data augmentation method based on local image warping for medical image segmentation,False,True,True,True
Investigation of MRI Prostate Localization using Different MRI Modality Scans,False,True,True,True
Dilated Volumetric Network: an Enhanced Fully Convolutional Network for Volumetric Prostate Segmentation from Magnetic Resonance Imaging,False,True,True,True
ProSegNet: A New Network of Prostate Segmentation Based on MR Images,False,True,True,True
Intelligent Computer-Aided Prostate Cancer Diagnosis Systems: State-of-the-Art and Future Directions,False,True,True,True
Versatile Convolutional Networks Applied to Computed Tomography and Magnetic Resonance Image Segmentation,False,True,True,True
Morphable Convolutional Neural Network for Biomedical Image Segmentation,False,True,True,True
Deep Reinforcement Learning in Computer Vision: A Comprehensive Survey,False,True,True,False
The Growing Role for Semantic Segmentation in Urology,False,True,True,True
Learning multi-scale synergic discriminative features for prostate image segmentation,False,True,True,True
A novel prostate segmentation method: triple fusion model with hybrid loss,False,True,True,True
FEW-SHOT Image Segmentation for Cross-Institution Male Pelvic Organs Using Registration-Assisted Prototypical Learning,False,True,True,True
Source Free Domain Adaptation for Medical Image Segmentation with Fourier Style Mining,False,True,False,False
Long-Range 3D Self-Attention for MRI Prostate Segmentation,False,True,True,True
Auto-contouring for Image-Guidance and Treatment Planning,False,True,True,True
DLTTA: Dynamic Learning Rate for Test-Time Adaptation on Cross-Domain Medical Images,False,True,True,False
Brain Tumour Segmentation on 3D MRI Using Attention V-Net,False,True,True,False
Multi‐scale discriminative network for prostate cancer lesion segmentation in multiparametric MR images,False,True,True,True
Emerging MR methods for improved diagnosis of prostate cancer by multiparametric MRI,False,True,True,True
A review on the use of deep learning for medical images segmentation,False,True,True,True
Segmentation of Liver Tumor in CT Scan Using ResU-Net,False,True,False,True
Artificial Intelligence for Clinical Diagnosis and Treatment of Prostate Cancer,False,True,True,True
Statistical Power in Image Segmentation: Relating Sample Size to Reference Standard Quality,False,True,True,True
Validation of a method for retroperitoneal tumor segmentation,False,True,True,True
Multi-view collaborative segmentation for prostate MRI images,False,True,False,True
Colour image segmentation using perceptual colour difference saliency algorithm,False,True,False,False
Densely Dilated Spatial Pooling Convolutional Network using benign loss  functions for imbalanced volumetric prostate segmentation,False,True,True,False
Prostate segmentation using Z-net,False,True,True,False
On Computer-Aided Diagnosis of Prostate Cancer from MRI using Machine Intelligence Techniques,False,True,True,True
CNS: CycleGAN-Assisted Neonatal Segmentation Model for Cross-Datasets,False,True,True,True
Database Acquisition for the Lung Cancer Computer Aided Diagnostic Systems,False,True,True,True
Optimization of Multi-Atlas Segmentation with Joint Label Fusion Algorithm for Automatic Segmentation in Prostate MR Imaging,False,True,True,True
A Study on Using Deep Learning for Segmentation of Medical Image,False,True,True,True
Medical Imaging Based Diagnosis Through Machine Learning and Data Analysis,False,True,True,True
Integration of Dynamic Multi-Atlas and Deep Learning Techniques to Improve Segmentation of the Prostate in MR Images,False,True,True,True
Federated Whole Prostate Segmentation in MRI with Personalized Neural  Architectures,False,True,True,False
Hcdg: A Hierarchical Consistency Framework for Domain Generalization on Medical Image Segmentation,False,True,False,False
An Improved U-Net for Human Sperm Head Segmentation,False,True,True,True
Group Shift Pointwise Convolution for Volumetric Medical Image Segmentation,False,True,True,True
Group Shift Pointwise Convolution for Volumetric Medical Image  Segmentation,False,True,True,False
Causality-inspired Single-source Domain Generalization for Medical Image  Segmentation,False,False,True,False
Automatic prostate segmentation of magnetic resonance imaging using Res-Net,False,True,True,True
Segmentation of male pelvic organs on computed tomography with a deep neural network fine-tuned by a level-set method,False,True,True,True
Computer-aided segmentation on MRI for prostate radiotherapy part II: Comparing human and computer observer populations and the influence of annotator variability on algorithm variability,False,True,True,True
A novel registration‐based algorithm for prostate segmentation via the combination of SSM and CNN,False,True,True,True
MaxStyle: Adversarial Style Composition for Robust Medical Image Segmentation,False,False,True,False
Learning Towards Synchronous Network Memorizability and Generalizability for Continual Segmentation Across Multiple Sites,False,True,True,False
Automatic prostate and peri-prostatic fat segmentation based on pyramid mechanism fusion network for T2-weighted MRI,False,True,True,True
Automatic segmentation of prostate MRI based on 3D pyramid pooling Unet,False,True,True,False
Multi-parametric Magnetic Resonance Imaging Fusion for Automatic Classification of Prostate Cancer,False,True,True,True
Atlas-Based Semantic Segmentation of Prostate Zones,False,True,True,True
Estimating Model Performance Under Domain Shifts with Class-Specific Confidence Scores,False,True,True,False
Domain and Content Adaptive Convolution Based Multi-Source Domain Generalization for Medical Image Segmentation,False,True,True,False
Segmentation Mask Resampling for MRI Prostate Localization Improvement,False,True,True,True
