DOI,../extracted_csv/paper_poci.csv,../extracted_csv/paper_openalex.csv,../extracted_csv/paper_dimensions.csv,../extracted_csv/paper_coci.csv
An Approach to Examine Brain Tumor Based on Kapur’s Entropy and Chan–Vese Algorithm,False,True,False,True
Altered White Matter Connectivity Associated with Intergyral Brain Disorganization in Hemiplegic Cerebral Palsy,False,True,False,True
Automatic Brain Tumor Segmentation by Exploring the Multi-modality Complementary Information and Cascaded 3D Lightweight CNNs,False,True,False,True
Glioblastoma Survival Prediction,False,True,False,True
Ensemble of Multiple Classifiers for Automatic Multimodal Brain Tumor Segmentation,False,True,False,True
Brain Tumor Segmentation and Classification Using MRI Images via Fully Convolution Neural Networks,False,True,False,True
An Automatic Brain Tumor Image Segmentation Method Based on the U-net,False,True,False,True
Using Synthetic Training Data for Deep Learning-Based GBM Segmentation,False,True,False,True
A Feature Ranking and Selection Algorithm for Brain Tumor Segmentation in Multi-Spectral Magnetic Resonance Image Data *,False,True,False,False
Image segmentation algorithm based on neutrosophic fuzzy clustering with non‐local information,False,True,False,True
Gradient‐based kernel selection technique for tumour detection and extraction of medical images using graph cut,False,True,False,True
Brain MRI Tumor Segmentation with Adversarial Networks,False,True,False,True
Automatic Brain Tumour Segmentation using fully Convolution Network and Transfer Learning,False,True,False,False
Stacked Sparse Autoencoder and Softmax Classifier Framework to Classify MRI of Brain Tumor Images,False,True,False,False
Hybrid Labels for Brain Tumor Segmentation,False,True,False,True
Knowledge Distillation for Brain Tumor Segmentation,False,True,False,True
Stochastic Segmentation Networks: Modelling Spatially Correlated  Aleatoric Uncertainty,False,True,False,False
DDeep3M: Docker-powered deep learning for biomedical image segmentation,False,True,False,True
Deep learning based brain tumor segmentation: a survey,False,True,False,True
The use of laser interstitial thermal therapy in the treatment of brain metastases: a literature review,False,True,False,True
Brain Tumor Segmentation Using 3D Generative Adversarial Networks,False,True,False,True
Task Decomposition and Synchronization for Semantic Biomedical Image Segmentation,False,True,False,True
Adversarial Perturbation on MRI Modalities in Brain Tumor Segmentation,False,True,False,True
Feasibility of MRI-based radiomics features for predicting lymph node metastases and VEGF expression in cervical cancer,False,True,False,True
Brain Tumour Segmentation in FLAIR MRI Using Sliding Window Texture Feature Extraction Followed by Fuzzy C-Means Clustering,False,True,False,False
MRI-based brain tumor detection using the fusion of histogram oriented gradients and neural features,False,True,False,True
Three‐dimensional multipath DenseNet for improving automatic segmentation of glioblastoma on pre‐operative multimodal MR images,False,True,False,True
MC 2 ‐Net: motion correction network for multi‐contrast brain MRI,False,True,False,False
MRI Brain Tumor Segmentation and Uncertainty Estimation Using 3D-UNet Architectures,False,True,False,True
Brain Tumor Segmentation and Survival Prediction Using Automatic Hard Mining in 3D CNN Architecture,False,True,False,True
Impact of Spherical Coordinates Transformation Pre-processing in Deep Convolution Neural Networks for Brain Tumor Segmentation and Survival Prediction,False,True,False,True
Automatic Brain Tumor Segmentation with Scale Attention Network,False,True,False,True
Context Aware 3D UNet for Brain Tumor Segmentation,False,True,False,True
Artificial intelligence in oncology: From bench to clinic,False,True,False,True
Second-order ResU-Net for automatic MRI brain tumor segmentation,False,True,False,True
Multi-view hierarchical split network for brain tumor segmentation,False,True,False,True
Morphological active contour model for automatic brain tumor extraction from multimodal magnetic resonance images,False,True,False,True
Knowledge and attitudes towards artificial intelligence in imaging: a look at the quantitative survey literature,False,True,False,True
MM-BiFPN: Multi-Modality Fusion Network With Bi-FPN for MRI Brain Tumor Segmentation,False,True,False,True
Deep Learning for Outcome Prediction in Neurosurgery,False,True,False,True
A Hybrid CNN-GLCM Classifier For Detection And Grade Classification Of Brain Tumor,False,True,False,True
What are the true volumes of SEGA tumors? Reliability of planimetric and popular semi-automated image segmentation methods,False,True,False,True
Three Aspects on Using Convolutional Neural Networks for Computer-Aided Detection in Medical Imaging,False,True,False,True
Efficient and Accurate Hausdorff Distance Computation Based on Diffusion Search,False,True,False,True
Residual Encoder and Convolutional Decoder Neural Network for Glioma Segmentation,False,True,False,True
Wavelet Transform to Improve Accuracy of a Prediction Model for Overall Survival Time of Brain Tumor Patients Based On MRI Images,False,True,False,True
An Efficient Brain Tumor Detection and Segmentation in MRI Using Parameter-Free Clustering,False,True,False,True
The application of convolution neural network based cell segmentation during cryopreservation,False,True,False,True
3D Deep Learning for Automatic Brain MR Tumor Segmentation with T-Spline Intensity Inhomogeneity Correction,False,True,False,True
Multiclass Brain Tumor Classification using Region Growing based Tumor Segmentation and Ensemble Wavelet Features,False,True,False,True
Brain Tumour Segmentation Method Based on Supervoxels and Sparse Dictionaries,False,True,False,True
Neuro-radiological characteristics of adult diffuse grade II and III insular gliomas classified according to WHO 2016,False,True,False,True
An intensity factorized thresholding based segmentation technique with gradient discrete wavelet fusion for diagnosing stroke and tumor in brain MRI,False,True,False,True
Multi-class multimodal semantic segmentation with an improved 3D fully convolutional networks,False,True,False,True
Regression based overall survival prediction of glioblastoma multiforme patients using a single discovery cohort of multi-institutional multi-channel MR images,False,True,False,True
A Deep Learning Method for Lung Segmentation on Large Size Chest X-Ray Image,False,True,False,True
An improved computer based diagnosis system for early detection of abnormal lesions in the brain tissues with using magnetic resonance and computerized tomography images,False,True,False,True
Multi-Task Attention-Based Semi-Supervised Learning for Medical Image  Segmentation,False,True,False,False
3D Deep Attention Network for Survival Prediction from Magnetic Resonance Images in Glioblastoma,False,True,False,True
Medical Image Segmentation with Stochastic Aggregated Loss in a Unified U-Net,False,True,False,True
Predictable Uncertainty-Aware Unsupervised Deep Anomaly Segmentation,False,True,False,True
An Effective MR-Guided CT Network Training for Segmenting Prostate in CT Images,False,True,False,False
Multimodal Brain Tumour Segmentation using Densely Connected 3D Convolutional Neural Network,False,True,False,True
Glioma Brain Tumors Diagnosis and Classification in MR Images based on Convolutional Neural Networks,False,True,False,True
Convolutional 3D to 2D Patch Conversion for Pixel-Wise Glioma Segmentation in MRI Scans,False,True,False,False
Fractional Crank-Nicolson finite difference method for benign brain tumor detection and segmentation,False,True,False,True
A Multi-path Decoder Network for Brain Tumor Segmentation,False,True,False,True
Brain Tumor Segmentation Using Dense Channels 2D U-net and Multiple Feature Extraction Network,False,True,False,True
Detection and Segmentation of Brain Tumors from MRI Using U-Nets,False,True,False,True
Optimization with Soft Dice Can Lead to a Volumetric Bias,False,True,False,True
Glioma Grade Prediction Using Wavelet Scattering-Based Radiomics,False,True,False,True
3D Inception U‐net with Asymmetric Loss for Cancer Detection in Automated Breast Ultrasound,False,True,False,True
Counterfeit Anomaly Using Generative Adversarial Network for Anomaly Detection,False,True,False,True
Combination of contrast enhanced fuzzy c-means (CEFCM) clustering and pixel based voxel mapping technique (PBVMT) for three dimensional brain tumour detection,False,True,False,True
2ST-UNet: 2-Stage Training Model using U-Net for Pneumothorax Segmentation in Chest X-Rays,False,True,False,True
Automated classification of urinary stones based on microcomputed tomography images using convolutional neural network,False,True,False,True
Deep learning for brain disorders: from data processing to disease treatment,False,True,False,True
Multi-stage Deep Layer Aggregation for Brain Tumor Segmentation,False,True,False,False
3D Semantic Segmentation of Brain Tumor for Overall Survival Prediction,False,True,False,True
HI-Net: Hyperdense Inception 3D UNet for Brain Tumor Segmentation,False,True,False,True
Trialing U-Net Training Modifications for Segmenting Gliomas Using Open Source Deep Learning Framework,False,True,False,True
Brain Tumor Segmentation Network Using Attention-Based Fusion and Spatial Relationship Constraint,False,True,False,True
Exploring Radiologic Criteria for Glioma Grade Classification on the BraTS Dataset,False,True,False,True
RD2A: densely connected residual networks using ASPP for brain tumor segmentation,False,True,False,True
Segmentation of MRI Brain Tumor Image using Optimization based Deep Convolutional Neural networks (DCNN),False,True,False,True
GA-UNet: UNet-based framework for segmentation of 2D and 3D medical images applicable on heterogeneous datasets,False,True,False,True
A data constrained approach for brain tumour detection using fused deep features and SVM,False,True,False,True
Gaussian process regression-based learning rate optimization in convolutional neural networks for medical images classification,False,True,False,True
<scp>Nonlocal</scp> convolutional block attention module <scp>VNet</scp> for gliomas automatic segmentation,False,True,False,False
Deep Symmetric Adaptation Network for Cross-Modality Medical Image Segmentation,False,False,True,True
Self-Supervised Multi-Modal Hybrid Fusion Network for Brain Tumor Segmentation,False,True,False,True
Super-resolution reconstruction of brain magnetic resonance images via lightweight autoencoder,False,True,False,True
Orthogonal Ensemble Networks for Biomedical Image Segmentation,False,True,False,True
Imbalance-Aware Self-supervised Learning for 3D Radiomic Representations,False,True,False,True
DR-Net: dual-rotation network with feature map enhancement for medical image segmentation,False,True,False,True
Brain tumor segmentation with corner attention and high-dimensional perceptual loss,False,True,False,True
Scale-adaptive super-feature based MetricUNet for brain tumor segmentation,False,True,False,True
Brain tumor segmentation in MRI images using nonparametric localization and enhancement methods with U-net,False,True,False,True
Accurate Automatic Glioma Segmentation in Brain MRI images Based on CapsNet,False,True,False,True
Künstliche Intelligenz und maschinelles Lernen in der onkologischen Bildgebung,False,True,False,True
Multimodal MRI Volumetric Data Fusion With Convolutional Neural Networks,False,True,False,True
A hybrid approach for detection of brain tumor in MRI images,False,True,False,True
Brain Tumor Segmentation,False,True,False,False
Automatic Brain Tumor Segmentation in Multispectral MRI Volumetric Records,False,True,False,False
Uncertainty quantification in brain tumor segmentation using CRFs and random perturbation models,False,True,False,False
Comparative Study of K-means Gaussian Mixture Model Fuzzy C-means algorithms for Brain Tumor Segmentation,False,True,False,False
Brain Tumor Segmentation by Variability Characterization of Tumor Boundaries,False,True,False,True
Representation Learning for Cross-Modality Classification,False,True,False,True
Computer-based radiological longitudinal evaluation of meningiomas following stereotactic radiosurgery,False,True,False,True
Semi-Automated Segmentation of Glioblastomas in Brain MRI Using Machine Learning Techniques,False,True,False,True
Brain Tumor Segmentation and Parsing on MRIs Using Multiresolution Neural Networks,False,True,False,True
A topo-graph model for indistinct target boundary definition from anatomical images,False,True,False,True
Non-negative matrix factorization and self-organizing map for brain tumor segmentation,False,True,False,True
A comparative study of classification methods for automatic multimodal brain tumor segmentation,False,True,False,True
MRI Cross-Modality NeuroImage-to-NeuroImage Translation,False,True,False,False
Edge detection using Chebyshev's orthogonal polynomial and brain extraction from magnetic resonance images of human head,False,True,False,True
MRI Brain Tumor Segmentation Combining Saliency and Convolutional Network Features,False,True,False,True
MRI Brain Tumour Segmentation Based on Multimodal Clustering and Level-set Method,False,True,False,True
A Combined Radio-Histological Approach for Classification of Low Grade Gliomas,False,True,False,True
Medical image retrieval using Resnet-18 for clinical diagnosis,False,True,False,True
Breast Cancer Detection Based on Merging Four Modes MRI Using Convolutional Neural Networks,False,True,False,True
Unsupervised learning‐based clustering approach for smart identification of pathologies and segmentation of tissues in brain magnetic resonance imaging,False,True,False,True
Estimating uncertainty in MRF-based image segmentation: A perfect-MCMC approach,False,True,False,True
Understanding and Interpreting Machine Learning in Medical Image Computing Applications,False,True,False,False
Automatic Segmentation and Overall Survival Prediction in Gliomas Using Fully Convolutional Neural Network and Texture Analysis,False,True,False,True
Models Genesis: Generic Autodidactic Models for 3D Medical Image  Analysis,False,True,False,False
Multi-stream Convolutional Autoencoder and 2D Generative Adversarial Network for Glioma Classification,False,True,False,True
Brain Tumor Detection and Segmentation from Magnetic Resonance Image Data Using Ensemble Learning Methods,False,True,False,True
Radiomics-Enhanced Multi-task Neural Network for Non-invasive Glioma Subtyping and Segmentation,False,True,False,True
Weakly Supervised Fine Tuning Approach for Brain Tumor Segmentation Problem,False,True,False,True
Recent nature-Inspired algorithms for medical image segmentation based on tsallis statistics,False,True,False,True
Patch and Pixel Based Brain Tumor Segmentation in MRI images using Convolutional Neural Networks,False,True,False,False
Extraction of Gliomas from 3D MRI Images using Convolution Kernel Processing and Adaptive Thresholding,False,True,False,True
An Integrative Analysis of Image Segmentation and Survival of Brain Tumour Patients,False,True,False,True
Using Separated Inputs for Multimodal Brain Tumor Segmentation with 3D U-Net-like Architectures,False,True,False,True
Domain Knowledge Based Brain Tumor Segmentation and Overall Survival Prediction,False,True,False,True
Aggregating Multi-scale Prediction Based on 3D U-Net in Brain Tumor Segmentation,False,True,False,True
A Medical Image Segmentation Method With Anti-Noise and Bias-Field Correction,False,True,False,True
Brain Tumor Segmentation with Cascaded Deep Convolutional Neural Network,False,True,False,True
DDU-Nets: Distributed Dense Model for 3D MRI Brain Tumor Segmentation,False,True,False,True
A reliable ensemble-based classification framework for glioma brain tumor segmentation,False,True,False,True
A computation-efficient CNN system for high-quality brain tumor segmentation,False,True,False,True
Multimodal Medical Image Fusion Based on Discrete Wavelet Transform and Genetic Algorithm,False,True,False,True
A radiomics–clinical nomogram for preoperative prediction of IDH1 mutation in primary glioblastoma multiforme,False,True,False,True
Model-Driven Deep Attention Network for Ultra-fast Compressive Sensing MRI Guided by Cross-contrast MR Image,False,True,False,True
A comprehensive study of brain tumour discrimination using phase combinations feature rankings and hybridised classifiers,False,True,False,True
Superpixel-based brain tumor segmentation in MR images using an extended local fuzzy active contour model,False,True,False,True
Parallel pathway dense neural network with weighted fusion structure for brain tumor segmentation,False,True,False,True
Learn Distributed GAN with Temporary Discriminators,False,True,False,True
Integrating saliency with fuzzy thresholding for brain tumor extraction in MR images,False,True,False,True
Boundary-Aware Supervoxel-Level Iteratively Refined Interactive 3D Image Segmentation With Multi-Agent Reinforcement Learning,False,True,False,True
Recent Advancements in Fuzzy C-means Based Techniques for Brain MRI Segmentation,False,True,False,True
Survival prediction of patients suffering from glioblastoma based on two-branch DenseNet using multi-channel features,False,True,False,True
Brain tumor segmentation via C-dense convolutional neural network,False,True,False,True
Glioma classification via MR images radiomics analysis,False,True,False,True
A Survey and Analysis on Automated Glioma Brain Tumor Segmentation and Overall Patient Survival Prediction,False,True,False,True
Active contour model driven by optimized energy functionals for MR brain tumor segmentation with intensity inhomogeneity correction,False,True,False,True
Squeeze-and-Excitation Normalization for Brain Tumor Segmentation,False,True,False,True
Enhancing MRI Brain Tumor Segmentation with an Additional Classification Network,False,True,False,True
Glioma Segmentation Using Ensemble of 2D/3D U-Nets and Survival Prediction Using Multiple Features Fusion,False,True,False,True
Multiagent Reinforcement Learning for Hyperparameter Optimization of Convolutional Neural Networks,False,True,False,True
Offset Curves Loss for Imbalanced Problem in Medical Segmentation,False,True,False,False
A Survey on Active Deep Learning: From Model Driven to Data Driven,False,True,False,True
Deep unregistered multi-contrast MRI reconstruction,False,True,False,True
Deep learning techniques for tumor segmentation: a review,False,True,False,True
Brain tumor segmentation and overall survival period prediction in glioblastoma multiforme using radiomic features,False,True,False,True
MTANS: Multi-Scale Mean Teacher Combined Adversarial Network with Shape-Aware Embedding for Semi-Supervised Brain Lesion Segmentation,False,True,False,True
Exploring the U-Net++ Model for Automatic Brain Tumor Segmentation,False,True,False,True
Patch-Free 3D Medical Image Segmentation Driven by Super-Resolution Technique and Self-Supervised Guidance,False,True,False,True
DPANet: Dual Pooling‐aggregated Attention Network for fish segmentation,False,True,False,True
ACN: Adversarial Co-training Network for Brain Tumor Segmentation with Missing Modalities,False,True,False,True
Multi-scale Neural ODEs for 3D Medical Image Registration,False,True,False,True
Relax and focus on brain tumor segmentation,False,True,False,True
Fully Automatic Head and Neck Cancer Prognosis Prediction in PET/CT,False,True,False,True
Automated post-operative brain tumour segmentation: A deep learning model based on transfer learning from pre-operative images,False,True,False,True
Brain Tumor Segmentation From Multi-Modal MR Images via Ensembling UNets,False,True,False,True
Spherical coordinates transformation pre-processing in Deep Convolution Neural Networks for brain tumor segmentation in MRI,False,False,True,True
Brain Tumor Segmentation of MRI Images Using Processed Image Driven U-Net Architecture,False,True,False,True
Dense Dilated Deep Multiscale Supervised U-Network for biomedical image segmentation,False,True,False,True
Brain Tumor Detection and Classification Using Cycle Generative Adversarial Networks,False,True,False,True
An Interactive Deep Learning Approach for Brain Tumor Detection Through 3D-Magnetic Resonance Images,False,True,False,False
MR brain segmentation based on DE-ResUnet combining texture features and background knowledge,False,True,False,True
HGG and LGG Brain Tumor Segmentation in Multi-Modal MRI Using Pretrained Convolutional Neural Networks of Amazon Sagemaker,False,True,False,False
A Comprehensive Survey on Brain Tumor Diagnosis Using Deep Learning and Emerging Hybrid Techniques with Multi-modal MR Image,False,True,False,True
A Robust Approach for Brain Tumor Detection in Magnetic Resonance Images Using Finetuned EfficientNet,False,True,False,True
Brain Tumor Analysis Using Deep Learning and VGG-16 Ensembling Learning Approaches,False,True,False,False
CrossMoDA 2021 challenge: Benchmark of cross-modality domain adaptation techniques for vestibular schwannoma and cochlea segmentation,False,False,True,True
Automated segmentation of brain tumors in MRI using potential field clustering,False,True,False,False
MBIS: Multivariate Bayesian Image Segmentation tool,False,True,False,False
Unsupervised Pathological Area Extraction using 3D T2 and FLAIR MR Images,False,True,False,False
A generative model for segmentation of tumor and organs-at-risk for radiation therapy planning of glioblastoma patients,False,True,False,True
An N log N Parallel Fast Direct Solver for Kernel Matrices,False,True,False,False
A Semi-Automated Segmentation Framework for MRI Based Brain Tumor Segmentation Using Regularized Nonnegative Matrix Factorization,False,True,False,True
Comparison of Classifiers for Brain Tumor Segmentation,False,True,False,True
Wavelet transform-based steganographic method for secure data communication using OFDM system,False,True,False,True
Contrast enhanced brain tumor segmentation based on Shannon's entropy and active contour,False,True,False,True
Novel approach for brain tumor segmentation with non negative matrix factorization,False,True,False,True
Image segmentation by level set evolution with region consistency constraint,False,True,False,True
Segmentation of tumor and edema based on K-mean clustering and hierarchical centroid shape descriptor,False,True,False,True
The application of series multi-pooling convolutional neural networks for medical image segmentation,False,True,False,True
Convolution of 3D Gaussian surfaces for volumetric intensity inhomogeneity estimation and correction in 3D brain MR image data,False,True,False,True
Automated techniques for brain tumor segmentation and detection: A review study,False,True,False,False
Comparative study of supervised and unsupervised classification methods: Application to automatic MRI glioma brain tumors segmentation,False,True,False,False
Supervoxel-based segmentation of 3D imagery with optical flow integration for spatiotemporal processing,False,True,False,True
Walsh Hadamard kernel-based texture feature for multimodal MRI brain tumour segmentation,False,True,False,True
Automatic segmentation of colorectal cancer in 3D MRI by combining deep learning and 3D level-set algorithm-a preliminary study,False,True,False,True
Segmentation of Brain Tumor Tissues in HGG and LGG MR Images Using 3D U-net Convolutional Neural Network,False,True,False,True
Tumor Delineation for Brain Radiosurgery by a ConvNet and Non-uniform Patch Generation,False,True,False,True
Intensity Inhomogeneity Correction for Magnetic Resonance Imaging of Automatic Brain Tumor Segmentation,False,True,False,True
Automatic Segmentation of Brain Tumor Using 3D SE-Inception Networks with Residual Connections,False,True,False,True
EEG Channel Selection using Fractal Dimension and Artificial Bee Colony Algorithm,False,True,False,True
Detection of HGG and LGG Brain Tumors using U-Net,False,True,False,False
Four-Sequence Maximum Entropy Discrimination Algorithm for Glioma Grading,False,True,False,True
Deep Leaming Approaches for Brain Tumor Segmentation: A Review,False,True,False,True
Automated and reliable brain radiology with texture analysis of magnetic resonance imaging and cross datasets validation,False,True,False,True
Segmenting Brain Tumour Regions with Fuzzy Integrated Active Contours,False,True,False,True
A Computer-aided Diagnosis System for Glioma Grading using Three Dimensional Texture Analysis and Machine Learning in MRI Brain Tumour,False,True,False,True
Joint Sequence Learning and Cross-Modality Convolution for 3D Biomedical  Segmentation,False,True,False,False
Brain Tumor Segmentation Using Discriminator Loss,False,True,False,True
A soft-computing based hybrid tool to extract the tumour section from brain MRI,False,True,False,True
Plaque Recognition of Carotid Ultrasound Images Based on Deep Residual Network,False,True,False,True
Automated brain tumor segmentation from multi-slices FLAIR MRI images,False,True,False,True
Automated brain tumor segmentation from multimodal MRI data based on Tamura texture feature and an ensemble SVM classifier,False,True,False,True
Brain Tumor Detection Using Manifold Ranking in FLAIR MRI,False,True,False,True
Automatic Brain Tumor Segmentation Method Based on Modified Convolutional Neural Network,False,True,False,True
Fuzzy volumetric delineation of brain tumor and survival prediction,False,True,False,True
Intraoperative brain tumour identification with deep learning,False,True,False,True
Parallel Deep CNN Structure for Glioma Detection and Classification via Brain MRI Images,False,True,False,True
Multi-modal U-Nets with Boundary Loss and Pre-training for Brain Tumor Segmentation,False,True,False,True
Ensemble of CNNs for Segmentation of Glioma Sub-regions with Survival Prediction,False,True,False,True
Brain Tumor Segmentation Based on Attention Mechanism and Multi-model Fusion,False,True,False,True
