DOI,../extracted_csv/paper_poci.csv,../extracted_csv/paper_openalex.csv,../extracted_csv/paper_dimensions.csv,../extracted_csv/paper_coci.csv
An Ensemble Approach to Automatic Brain Tumor Segmentation,False,True,False,False
Generalized Wasserstein Dice Loss Test-Time Augmentation and Transformers for the BraTS 2021 Challenge,False,True,False,False
Brain Tumor Segmentation from Multiparametric MRI Using a Multi-encoder U-Net Architecture,False,True,False,False
Automatic Brain Tumor Segmentation with a Bridge-Unet Deeply Supervised Enhanced with Downsampling Pooling Combination Atrous Spatial Pyramid Pooling Squeeze-and-Excitation and EvoNorm,False,True,False,False
Dice Focal Loss with ResNet-like Encoder-Decoder Architecture in 3D Brain Tumor Segmentation,False,True,False,False
Comparison of MR Preprocessing Strategies and Sequences for Radiomics-Based MGMT Prediction,False,True,False,False
MS UNet: Multi-scale 3D UNet for Brain Tumor Segmentation,False,True,False,False
Feature Learning by Attention and Ensemble with 3D U-Net to Glioma Tumor Segmentation,False,True,False,True
Disparity Autoencoders for Multi-class Brain Tumor Segmentation,False,True,False,True
Brain Tumor Segmentation with Patch-Based 3D Attention UNet from Multi-parametric MRI,False,True,False,True
Neural Network Based Brain Tumor Segmentation,False,True,False,True
Efficient Federated Tumor Segmentation via Normalized Tensor Aggregation and Client Pruning,False,True,False,False
MRI Brain Tumor Segmentation Using Deep Encoder-Decoder Convolutional Neural Networks,False,True,False,True
Deep Active Contour-Based Capsule Network for Medical Image Segmentation,False,True,False,True
A novel automatic approach for glioma segmentation,False,True,False,True
Brain Tumor Segmentation Using U-net and U-net++ Networks,False,True,False,True
Brain Tumor Segmentation using Multimodal MRI and Convolutional Neural Network,False,True,False,True
BRATS2021: Exploring Each Sequence in Multi-modal Input for Baseline U-net Performance,False,True,False,False
Combining Global Information with Topological Prior for Brain Tumor Segmentation,False,True,False,False
A Two-Phase Optimal Mass Transportation Technique for 3D Brain Tumor Detection and Segmentation,False,False,True,False
Multi Modal Fusion for Radiogenomics Classification of Brain Tumor,False,True,False,False
A Video Data Based Transfer Learning Approach for Classification of MGMT Status in Brain Tumor MR Images,False,True,False,False
EfficientNet for Brain-Lesion Classification,False,True,False,False
EMSViT: Efficient Multi Scale Vision Transformer for Biomedical Image Segmentation,False,True,False,False
3D MRI Brain Tumour Segmentation with Autoencoder Regularization and Hausdorff Distance Loss Function,False,True,False,False
Ensemble Outperforms Single Models in Brain Tumor Segmentation,False,True,False,False
Simple and Fast Convolutional Neural Network Applied to Median Cross Sections for Predicting the Presence of MGMT Promoter Methylation in FLAIR MRI Scans,False,True,False,False
Opportunities and Challenges for Deep Learning in Brain Lesions,False,True,False,False
Optimization of Deep Learning Based Brain Extraction in MRI for Low Resource Environments,False,True,False,False
Automatic Brain Tumor Segmentation Using Multi-scale Features and Attention Mechanism,False,True,False,False
Cascaded Training Pipeline for 3D Brain Tumor Segmentation,False,True,False,False
Hierarchical and Global Modality Interaction for Brain Tumor Segmentation,False,True,False,False
Residual 3D U-Net with Localization for Brain Tumor Segmentation,False,True,False,False
Brain Tumor Segmentation Using UNet-Context Encoding Network,False,True,False,False
Segmenting Brain Tumors in Multi-modal MRI Scans Using a 3D SegNet Architecture,False,True,False,False
Multi-plane UNet++ Ensemble for Glioblastoma Segmentation,False,True,False,False
CA-Net: Collaborative Attention Network for Multi-modal Diagnosis of Gliomas,False,True,False,False
HarDNet-BTS: A Harmonic Shortcut Network for Brain Tumor Segmentation,False,True,False,False
Brain Tumour Segmentation Using Convolution Neural Network,False,True,False,True
The Special Session Title ‘Intelligent Computing in Healthcare’ Dual Classification Framework for the Detection of Brain Tumor,False,True,False,True
Attention-Fused CNN Model Compression with Knowledge Distillation for Brain Tumor Segmentation,False,True,False,False
Fitting Segmentation Networks on Varying Image Resolutions Using Splatting,False,False,True,False
Enhancing level set brain tumor segmentation using fuzzy shape prior information and deep learning,False,True,False,True
Diabetic retinopathy screening using improved support vector domain description: a clinical study,False,True,False,True
Encrypted federated learning for secure decentralized collaboration in cancer image analysis,False,True,False,True
An Efficient Encoder-Decoder CNN for Brain Tumor Segmentation in MRI Images,False,True,False,True
Numerical Grad-Cam Based Explainable Convolutional Neural Network for Brain Tumor Diagnosis,False,True,False,True
ERCNN-DRM: an efficient regularized convolutional neural network with a dimensionality reduction module for the classification of brain tumour in magnetic resonance images,False,True,False,True
U-Net architecture variants for brain tumor segmentation of histogram corrected images,False,False,True,True
MSFR‐Net: Multi‐modality and single‐modality feature recalibration network for brain tumor segmentation,False,True,False,True
A 3D Medical Image Segmentation Framework Fusing Convolution and Transformer Features,False,True,False,True
TBC-Unet: U-net with Three-Branch Convolution for Gliomas MRI Segmentation,False,True,False,True
Fully Automated Conversion Of Glioma Clinical MRI Scans Into A 3D Virtual Reality Model For Presurgical Planning,False,True,False,True
Brain Tumor Segmentation in MRI Images Using A Modified U-Net Model,False,True,False,True
Identification of Intracranial Lesions Using Machine Learning. A Decision Support System Prototype for Critical Situations in Neuro-Oncology Clinics (Preprint),False,True,False,True
Squeeze and multi‐context attention for polyp segmentation,False,True,False,True
Optimizing Transformations for Contrastive Learning in a Differentiable Framework,False,True,False,False
Fractional Aquila spider monkey optimization based deep learning network for classification of brain tumor,False,True,False,True
An efficient R-Transformer network with dual encoders for brain glioma segmentation in MR images,False,True,False,True
Künstliche Intelligenz in der orthopädisch-unfallchirurgischen Radiologie,False,True,False,True
Integrating Residual Dense and Inception Blocks into the nnUNet,False,False,True,True
TSEUnet: A 3D neural network with fused Transformer and SE-Attention for brain tumor segmentation,False,True,False,True
Multi-scale feature pyramid fusion network for medical image segmentation,False,True,False,True
A-UNet: Attention 3D UNet architecture for multiclass segmentation of Brain Tumor,False,True,False,True
Development of a Tumor Diagnosis Application for Medical Practitioners using Transfer Learning,False,True,False,False
Challenges and opportunities for advanced neuroimaging of glioblastoma,False,True,False,True
Implement Improved Process Design Using a Lightweight Deep Learning Model to Reduce Hardware Computational Load in Instance Segmentation: Using Apple Dataset,False,True,False,True
StRegA: Unsupervised anomaly detection in brain MRIs using a compact context-encoding variational autoencoder,False,True,False,True
A Deep Graph Cut Model For 3D Brain Tumor Segmentation,False,True,False,True
X-Net: A Novel Deep Learning Architecture with High-resolution Feature Maps for Image Segmentation,False,True,False,True
Interpretable Machine Learning with Brain Image and Survival Data,False,True,False,True
Analysis of depth variation of U-NET architecture for brain tumor segmentation,False,True,False,True
SCENIC: An Area and Energy-Efficient CNN-based Hardware Accelerator for Discernable Classification of Brain Pathologies using MRI,False,True,False,True
Computational Intelligence in Medicine,False,True,False,False
A novel depth search based light weight CAR network for the segmentation of brain tumour from MR images,False,True,False,True
Deep learning and machine learning‐based early survival predictions of glioblastoma patients using pre‐operative <scp>three‐dimensional</scp> brain <scp>magnetic resonance imaging</scp> modalities,False,True,False,False
End-to-End Evidential-Efficient Net for Radiomics Analysis of Brain MRI to Predict Oncogene Expression and Overall Survival,False,True,False,False
Learning Tumor-Induced Deformations to Improve Tumor-Bearing Brain MR Segmentation,False,True,False,False
Modality-Adaptive Feature Interaction for Brain Tumor Segmentation with Missing Modalities,False,True,False,False
Stroke Lesion Segmentation from Low-Quality and Few-Shot MRIs via Similarity-Weighted Self-ensembling Framework,False,True,False,False
A Survey on Convolutional Neural Networks for MRI Analysis,False,True,False,True
DuDoCAF: Dual-Domain Cross-Attention Fusion with Recurrent Transformer for Fast Multi-contrast MR Imaging,False,True,False,False
MRI Reconstruction by Completing Under-sampled K-space Data with Learnable Fourier Interpolation,False,True,False,False
Survival Prediction of Brain Cancer with Incomplete Radiology Pathology Genomic and Demographic Data,False,True,False,False
Bayesian Pseudo Labels: Expectation Maximization for Robust and Efficient Semi-supervised Segmentation,False,True,False,False
NestedFormer: Nested Modality-Aware Transformer for Brain Tumor Segmentation,False,True,False,False
What Do Untargeted Adversarial Examples Reveal in Medical Image Segmentation?,False,True,False,False
FSE Compensated Motion Correction for MRI Using Data Driven Methods,False,True,False,False
Uncertainty Categories in Medical Image Segmentation: A Study of Source-Related Diversity,False,True,False,False
Multi-tracer PET Imaging Using Deep Learning: Applications in Patients with High-Grade Gliomas,False,True,False,False
Quantitative evaluation of the influence of multiple MRI sequences and of pathological tissues on the registration of longitudinal data acquired during brain tumor treatment,False,True,False,True
Can Segmentation Models Be Trained with Fully Synthetically Generated Data?,False,False,True,False
A Stratified Cascaded Approach for Brain Tumor Segmentation with the Aid of Multi-modal Synthetic Data,False,True,False,False
Multi-task Learning-Driven Volume and Slice Level Contrastive Learning for 3D Medical Image Classification,False,True,False,True
Meta Pixel Loss Correction for Medical Image Segmentation with Noisy Labels,False,True,False,False
Segmentation Method of Magnetoelectric Brain Image Based on the Transformer and the CNN,False,True,False,True
3D U-Net based method for fast segmentation of whole heart from CT images,False,True,False,True
Real-Time 3D Microwave Medical Imaging With Enhanced Variational Born Iterative Method,False,True,False,False
Hybrid Deep Learning Approach for Brain Tumor Segmentation and Classification,False,True,False,True
AutoGAN-Synthesizer: Neural Architecture Search for Cross-Modality MRI Synthesis,False,True,False,False
Automatic CAD System for Brain Diseases Classification Using CNN-LSTM Model,False,True,False,True
Image Segmentation for Medical Analysis,False,True,False,True
Robust multimodal fusion network using adversarial learning for brain tumor grading,False,True,False,True
LSW-Net: A Learning Scattering Wavelet Network for Brain Tumor and Retinal Image Segmentation,False,True,False,True
Global weighted average pooling network with multilevel feature fusion for weakly supervised brain tumor segmentation,False,True,False,True
Improved MR image reconstruction using federated learning,False,True,False,True
Memory consistent unsupervised off-the-shelf model adaptation for source-relaxed medical image segmentation,False,True,False,True
Multimodal CT Image Synthesis Using Unsupervised Deep Generative Adversarial Networks for Stroke Lesion Segmentation,False,True,False,True
Convex Hull in Brain Tumor Segmentation,False,True,False,False
MLRD-Net: 3D multiscale local cross-channel residual denoising network for MRI-based brain tumor segmentation,False,True,False,True
Brain Tumor MRI Image Segmentation Via Combining Pyramid Convolution and Attention Gate,False,True,False,True
Evolutionary convolutional neural network for efficient brain tumor segmentation and overall survival prediction,False,True,False,True
Cross-Modality High-Frequency Transformer for MR Image Super-Resolution,False,True,False,True
Clinical implementation of artificial intelligence in neuroradiology with development of a novel workflow-efficient picture archiving and communication system-based automated brain tumor segmentation and radiomic feature extraction,False,True,False,True
TCGAN: a transformer-enhanced GAN for PET synthetic CT,False,True,False,True
Multi-modal contrastive mutual learning and pseudo-label re-learning for semi-supervised medical image segmentation,False,True,False,True
Segmentation Algorithm of Magnetic Resonance Imaging Glioma under Fully Convolutional Densely Connected Convolutional Networks,False,True,False,True
A 3D Cross-Modality Feature Interaction Network With Volumetric Feature Alignment for Brain Tumor and Tissue Segmentation,False,True,False,False
Autosegmentation of brain metastases using 3D FCNN models and methods to manage GPU memory limitations,False,True,False,True
Explainable multi-module semantic guided attention based network for medical image segmentation,False,True,False,True
Weakly Supervised Learning with Positive and Unlabeled Data for Automatic Brain Tumor Segmentation,False,True,False,True
Brain Tumor Segmentation based on an Optimized Convolutional Neural Network and an Improved Chimp Optimization Algorithm,False,True,False,True
Towards survival prediction of cancer patients using medical images,False,True,False,True
Simulated MRI Artifacts: Testing Machine Learning Failure Modes,False,True,False,True
LETCP: A Label-Efficient Transformer-Based Contrastive Pre-Training Method for Brain Tumor Segmentation,False,True,False,True
Brain tumor segmentation and classification using hybrid deep CNN with LuNetClassifier,False,True,False,True
Enhancement of clustering techniques by coupling clustering tree and neural network: Application to brain tumour segmentation,False,True,False,True
Effect of Preprocessing and Loss Functions on a Novel Dataset: An Application on MRI-Based Prostate Lesion Segmentation using U-Net,False,True,False,True
Pure Versus Hybrid Transformers For Multi-Modal Brain Tumor Segmentation: A Comparative Study,False,True,False,False
Commercial volumetric MRI reporting tools in multiple sclerosis: a systematic review of the evidence,False,True,False,True
Temperature guided network for 3D joint segmentation of the pancreas and tumors,False,True,False,True
A novel approach for <scp>MR</scp> brain tumor classification and detection using optimal <scp>CNN‐SVM</scp> model,False,True,False,False
A deep learning framework integrating MRI image preprocessing methods for brain tumor segmentation and classification,False,True,False,True
Post-operative glioblastoma multiforme segmentation with uncertainty estimation,False,True,False,True
The multimodal MRI brain tumor segmentation based on AD-Net,False,True,False,True
Enc‐Unet: A novel method for Glioma segmentation,False,True,False,True
Semi‐supervised interactive fusion network for MR image segmentation,False,True,False,False
Detection and classification of brain tumor using hybrid feature extraction technique,False,True,False,True
Brain tumor classification based on neural architecture search,False,True,False,True
Targeting intra‐tumoral heterogeneity of human brain tumors with in vivo imaging: A roadmap for imaging genomics from multiparametric MR signals,False,True,False,True
Fully Convolutional Network for the Semantic Segmentation of Medical Images: A Survey,False,True,False,True
ConvNets for automatic detection of polyglutamine SCAs from brain MRIs: state of the art applications,False,True,False,True
Ensemble learning for glioma patients overall survival prediction using pre-operative MRIs,False,True,False,False
SGC-ARANet: scale-wise global contextual axile reverse attention network for automatic brain tumor segmentation,False,True,False,True
Machine Learning in the Classification of Pediatric Posterior Fossa Tumors: A Systematic Review,False,True,False,True
Skeletal Muscle Segmentation at the Third Lumbar Vertebral Level in Radiotherapy CT Images,False,True,False,False
Image prediction of disease progression for osteoarthritis by style-based manifold extrapolation,False,True,False,True
A Comprehensive Survey on MRI Images Classification for Brain Tumor Identification using Deep Learning Techniques,False,True,False,True
Visualising spatial heterogeneity in glioblastoma using imaging habitats,False,True,False,True
A Self-Attention-Guided 3D Deep Residual Network With Big Transfer to Predict Local Failure in Brain Metastasis After Radiotherapy Using Multi-Channel MRI,False,True,False,True
Deep mutual learning for brain tumor segmentation with the fusion network,False,True,False,True
Improved Complementary Pulmonary Nodule Segmentation Model Based on Multi-Feature Fusion,False,True,False,False
Glioma grade prediction using a cross-fusion network based on unsegmented multi-sequence magnetic resonance images,False,True,False,False
Predicting glioblastoma molecular subtypes and prognosis with a multimodal model integrating convolutional neural network radiomics and semantics,False,True,False,False
NDNN based U-Net: An Innovative 3D Brain Tumor Segmentation Method,False,True,False,False
A transformer-based generative adversarial network for brain tumor segmentation,False,True,False,True
Automated multi-modal Transformer network (AMTNet) for 3D medical images segmentation,False,True,False,False
An Ensemble Classification Method for Brain Tumor Images Using Small Training Data,False,True,False,False
Automated brain tumour segmentation from multi‐modality magnetic resonance imaging data based on new particle swarm optimisation segmentation method,False,True,False,False
Evrişimli Sinir Ağlarında Beyin Tümörü Segmentasyonu,False,True,False,False
A lightweight hierarchical convolution network for brain tumor segmentation,False,True,False,False
When bioprocess engineering meets machine learning: A survey from the perspective of automated bioprocess development,False,True,False,False
Segmentation ability map: Interpret deep features for medical image segmentation,False,True,False,False
The LUMIERE dataset: Longitudinal Glioblastoma MRI with expert RANO evaluation,False,True,False,False
Fully Automated Segmentation Models of Supratentorial Meningiomas Assisted by Inclusion of Normal Brain Images,False,True,False,False
Review of Semantic Segmentation of Medical Images Using Modified Architectures of UNET,False,True,False,False
Segmentation of Brain Glioma in MRI Images Using Deep Learning,False,True,False,False
An effective tumor detection in MR brain images based on deep CNN approach: <i>i-</i>YOLOV5,False,True,False,False
A Hybrid Approach to Segment and Detect Brain Abnormalities fron MRI Scan,False,True,False,False
Long future frame prediction using optical flow‐informed deep neural networks for enhancement of robotic teleoperation in high latency environments,False,True,False,False
Extracting Radiomic features from pre-operative and segmented MRI scans improved survival prognosis of glioblastoma Multiforme patients through machine learning: a retrospective study,False,True,False,False
Lesion delineation framework for vestibular schwannoma meningioma and brain metastasis for gamma knife radiosurgery using stereotactic magnetic resonance images,False,True,False,False
Evaluating the Clinical Utility of Artificial Intelligence Assistance and its Explanation on Glioma Grading Task,False,True,False,False
A multi-scale method based on U-Net for brain tumor segmentation,False,True,False,False
SAResU-Net: Shuffle attention residual U-Net for brain tumor segmentation,False,True,False,False
Multi-Modal Magnetic Resonance Images Segmentation Based on An Improved 3DUNet,False,True,False,False
RAAGR2-Net: A brain tumor segmentation network using parallel processing of multiple spatial frames,False,True,False,False
A survey of methods for brain tumor segmentation-based MRI images,False,True,False,False
A mathematical fuzzy fusion framework for whole tumor segmentation in multimodal MRI using Nakagami imaging,False,True,False,False
Towards fully automated deep-learning-based brain tumor segmentation: Is brain extraction still necessary?,False,True,False,False
Med-DANet: Dynamic Architecture Network for Efficient Medical Volumetric Segmentation,False,True,False,False
Prediction of Brain Tumor Recurrence Location Based on Kullback–Leibler Divergence and Nonlinear Correlation Learning,False,True,False,True
The Impact of Using Voxel-Level Segmentation Metrics on Evaluating Multifocal Prostate Cancer Localisation,False,True,False,False
Towards Real-World Federated Learning in Medical Image Analysis Using Kaapana,False,True,False,False
TensorMixup Data Augmentation Method for Fully Automatic Brain Tumor Segmentation,False,True,False,True
Towards More Efficient Data Valuation in Healthcare Federated Learning Using Ensembling,False,True,False,False
Human Knowledge-Guided and Task-Augmented Deep Learning for Glioma Grading,False,True,False,False
Graph-Constrained Contrastive Regularization for Semi-weakly Volumetric Segmentation,False,False,True,False
Generalizable Cross-modality Medical Image Segmentation via Style Augmentation and Dual Normalization,False,False,True,True
Adaptive Active Contour Model for Brain Tumor Segmentation,False,True,False,False
On Interpretability of CNNs for Multimodal Medical Image Segmentation,False,True,False,False
An Ensemble Survival Prediction Method of High-Grade Glioma based on Multi-Feature Fusion,False,True,False,True
Study of Transferability of ImageNet-Based Pretrained Model to Brain Tumor MRI Dataset,False,True,False,True
Are 3D better than 2D Convolutional Neural Networks for Medical Imaging Semantic Segmentation?,False,True,False,True
Robust Brain Diseases Classification Using CNN and Soft Computing Techniques,False,True,False,True
GGM-Net: Gradient Constraint on Multi-category Brain MRI Segmentation,False,True,False,False
Hybrid-DANet: An Encoder-Decoder Based Hybrid Weights Alignment With Multi-Dilated Attention Network for Automatic Brain Tumor Segmentation,False,True,False,True
Brain Tumor Segmentation Using Partial Depthwise Separable Convolutions,False,True,False,False
Accurate prediction of glioma grades from radiomics using a multi-filter and multi-objective-based method,False,True,False,False
Semi-supervised Distillation Learning Based on Swin Transformer for MRI Reconstruction,False,True,False,True
Assessment of Brain Tumor in Flair MRI Slice with Joint Thresholding and Segmentation,False,True,False,False
Temporal Context Matters: Enhancing Single Image Prediction with Disease Progression Representations,False,True,False,True
SEResU-Net for Multimodal Brain Tumor Segmentation,False,True,False,True
Brain Tumor Classification Using Deep Neural Network Based on MRI Images,False,True,False,True
A Survey on Brain Tumor Segmentation and Classification,False,True,False,True
Comparing Training Strategies Using Multi-Assessor Segmentation Labels for Barrett’s Neoplasia Detection,False,True,False,False
An Infusion Liquid Level Detection Method Based on Improved ROI Segmentation and Horizontal Lines Modification,False,True,False,True
High Grade Brain Cancer Segmentation by means of Deep Learning,False,True,False,True
Feature Extraction and Analysis of MR Images of Brain Tumors,False,True,False,False
AST-Net: Lightweight Hybrid Transformer for Multimodal Brain Tumor Segmentation,False,True,False,True
Reinforcement learning using Deep $$Q$$ networks and $$Q$$ learning accurately localizes brain tumors on MRI with very small training sets,False,True,False,False
A literature survey of MR-based brain tumor segmentation with missing modalities,False,True,False,False
Distributed Learning in Healthcare,False,True,False,False
Detection and Classification of Brain Tumor Using Machine Learning Algorithms,False,True,False,False
Specific features of designing a database for neuro-oncological 3D MRI images to be used in training artificial intelligence,False,True,False,False
Volumetric Segmentation of Brain Tumors Using Neural Networks,False,True,False,False
NS-HGlio: A generalizable and repeatable HGG segmentation and volumetric measurement AI algorithm for the longitudinal MRI assessment to inform RANO in trials and clinics,False,True,False,False
Segmentation of brain tumor MRI image based on improved attention module Unet network,False,True,False,False
Relevance maps: A weakly supervised segmentation method for 3D brain tumours in MRIs,False,True,False,False
A Comparison of Three Different Deep Learning-Based Models to Predict the MGMT Promoter Methylation Status in Glioblastoma Using Brain MRI,False,True,False,False
Axial Attention Convolutional Neural Network for Brain Tumor Segmentation with Multi-Modality MRI Scans,False,True,False,False
Deep belief network-based image processing for local directional segmentation in brain tumor detection,False,True,False,False
A Novel Generative Adversarial Network-Based Approach for Automated Brain Tumour Segmentation,False,True,False,False
HMNet: Hierarchical Multi-Scale Brain Tumor Segmentation Network,False,True,False,False
Generating post-hoc explanation from deep neural networks for multi-modal medical image analysis tasks,False,True,False,False
