name,DOI,publication_year,dataset_used
3D Deep Neural Network-Based Brain Tumor Segmentation Using Multimodality Magnetic Resonance Sequences,10.1007/978-3-319-75238-9_36,2017,BRATS
Dilated Convolutions for Brain Tumor Segmentation in MRI Scans,10.1007/978-3-319-75238-9_22,2017,BRATS
Automated glioma detection and segmentation using graphical models,10.1371/journal.pone.0200745,2018,BRATS
Deep Learning Versus Classical Regression for Brain Tumor Patient Survival Prediction,10.1007/978-3-030-11726-9_38,2018,BRATS
Multi-planar Spatial-ConvNet for Segmentation and Survival Prediction in Brain Cancer,10.1007/978-3-030-11726-9_9,2018,BRATS
Ensemble of Fully Convolutional Neural Network for Brain Tumor Segmentation from Magnetic Resonance Images,10.1007/978-3-030-11726-9_43,2018,BRATS
Glioma Segmentation with Cascaded UNet,10.1007/978-3-030-11726-9_17,2018,BRATS
Medical Image Segmentation Algorithm Based on Feedback Mechanism CNN,10.1155/2019/6134942,2019,BRATS
BCEFCM_S: Bias correction embedded fuzzy c-means with spatial constraint to segment multiple spectral images with intensity inhomogeneities and noises,10.1016/j.sigpro.2019.107347,2020,BRATS
Machine learning applications in imaging analysis for patients with pituitary tumors: a review of the current literature and future directions,10.1007/s11102-019-01026-x,2020,BRATS
Brain MRI Super-Resolution Using 3D Dilated Convolutional Encoder–Decoder Network,10.1109/access.2020.2968395,2020,BRATS
Radiomics may increase the prognostic value for survival in glioblastoma patients when combined with conventional clinical and genetic prognostic models,10.1007/s00330-020-07335-1,2021,BRATS
Where did the tumor start? An inverse solver with sparse localization for tumor growth models,10.1088/1361-6420/ab649c,2020,BRATS
Recent Advances in Variational Autoencoders With Representation Learning for Biomedical Informatics: A Survey,10.1109/access.2020.3048309,2021,BRATS
An improved framework for brain tumor analysis using MRI based on YOLOv2 and convolutional neural network,10.1007/s40747-021-00310-3,2021,BRATS
CANet: Context Aware Network for Brain Glioma Segmentation,10.1109/tmi.2021.3065918,2021,BRATS
Performance of machine learning algorithms for glioma segmentation of brain MRI: a systematic literature review and meta-analysis,10.1007/s00330-021-08035-0,2021,BRATS
Unsupervised brain tumor segmentation using a symmetric-driven adversarial network,10.1016/j.neucom.2021.05.073,2021,BRATS
3D AGSE-VNet: an automatic brain tumor MRI data segmentation framework,10.1186/s12880-021-00728-8,2022,BRATS
An artificial intelligence framework and its bias for brain tumor segmentation: A narrative review,10.1016/j.compbiomed.2022.105273,2022,BRATS
Brain tumor segmentation based on the fusion of deep semantics and edge information in multimodal MRI,10.1016/j.inffus.2022.10.022,2022,BRATS
Automatic metastatic brain tumor segmentation for stereotactic radiosurgery applications,10.1088/0031-9155/61/24/8440,2016,BRATS
Multimodal Brain Tumor Segmentation Using Ensemble of Forest Method,10.1007/978-3-319-75238-9_14,2017,BRATS
Low and high grade glioma segmentation in multispectral brain MRI data,10.2478/ausi-2018-0007,2018,BRATS
Segmenting Brain Tumors from MRI Using Cascaded Multi-modal U-Nets,10.1007/978-3-030-11726-9_2,2018,BRATS
Bayesian Generative Models for Knowledge Transfer in MRI Semantic Segmentation Problems,10.3389/fnins.2019.00844,2019,BRATS
Region-of-interest undersampled MRI reconstruction: A deep convolutional neural network approach,10.1016/j.mri.2019.07.010,2019,BRATS
Integrating Cross-modality Hallucinated MRI with CT to Aid Mediastinal Lung Tumor Segmentation,10.1007/978-3-030-32226-7_25,2019,BRATS
Neuroevolutionary based convolutional neural network with adaptive activation functions,10.1016/j.neucom.2019.11.090,2020,BRATS
Multiscale multimodal analysis of tumor heterogeneity in IDH1 mutant vs wild-type diffuse gliomas,10.1371/journal.pone.0219724,2019,BRATS
SAINT: Spatially Aware Interpolation NeTwork for Medical Slice Synthesis,10.1109/cvpr42600.2020.00777,2020,BRATS
DeepNeuro: an open-source deep learning toolbox for neuroimaging,10.1007/s12021-020-09477-5,2021,BRATS
PSIGAN: Joint Probabilistic Segmentation and Image Distribution Matching for Unpaired Cross-Modality Adaptation-Based MRI Segmentation,10.1109/tmi.2020.3011626,2020,BRATS
Classification of parotid gland tumors by using multimodal MRI and deep learning,10.1002/nbm.4408,2021,BRATS
Fostering reproducibility and generalizability in machine learning for clinical prediction modeling in spine surgery,10.1016/j.spinee.2020.10.006,2021,BRATS
Multi-Task Learning for Small Brain Tumor Segmentation from MRI,10.3390/app10217790,2020,BRATS
Observing deep radiomics for the classification of glioma grades,10.1038/s41598-021-90555-2,2021,BRATS
Self-Attentive Spatial Adaptive Normalization for Cross-Modality Domain Adaptation,10.1109/tmi.2021.3059265,2021,BRATS
Application and Construction of Deep Learning Networks in Medical Imaging,10.1109/trpms.2020.3030611,2021,BRATS
Medical Image Segmentation With Limited Supervision: A Review of Deep Network Models,10.1109/access.2021.3062380,2021,BRATS
Fine-Tuning Approach for Segmentation of Gliomas in Brain Magnetic Resonance Images with a Machine Learning Method to Normalize Image Differences among Facilities,10.3390/cancers13061415,2021,BRATS
Deep learning for segmentation in radiation therapy planning: a review,10.1111/1754-9485.13286,2021,BRATS
Analysis of Brain MRI Images Using Improved CornerNet Approach,10.3390/diagnostics11101856,2021,BRATS
Design of deep ensemble classifier with fuzzy decision method for biomedical image classification,10.1016/j.asoc.2021.108178,2021,BRATS
A structural and functional magnetic resonance imaging dataset of brain tumour patients,10.1038/sdata.2016.3,2016,BRATS
Virtual Raters for Reproducible and Objective Assessments in Radiology,10.1038/srep25007,2016,BRATS
Brain extraction from normal and pathological images: A joint PCA/Image-Reconstruction approach,10.1016/j.neuroimage.2018.04.073,2018,BRATS
Multi-modal PixelNet for Brain Tumor Segmentation,10.1007/978-3-319-75238-9_26,2017,BRATS
Glioma Segmentation Using a Novel Unified Algorithm in Multimodal MRI Images,10.1109/access.2018.2807698,2018,BRATS
Brain tumour segmentation from MRI using superpixels based spectral clustering,10.1016/j.jksuci.2018.01.009,2018,BRATS
Histogram equalization-based techniques for contrast enhancement of MRI brain Glioma tumor images: Comparative study,10.1109/atsip.2018.8364471,2018,BRATS
Brain Tumor Segmentation on MR Image Using K-Means and Fuzzy-Possibilistic Clustering,10.1109/iementech.2018.8465390,2018,BRATS
A fully automatic methodology for MRI brain tumour detection and segmentation,10.1080/13682199.2018.1545412,2019,BRATS
Quantifying risk associated with clinical trial termination: A text mining approach,10.1016/j.ipm.2018.11.009,2019,BRATS
A framework combining DNN and level-set method to segment brain tumor in multi-modalities MR image,10.1007/s00500-019-03778-x,2019,BRATS
Holistic Brain Tumor Screening and Classification Based on DenseNet and Recurrent Neural Network,10.1007/978-3-030-11723-8_21,2018,BRATS
Conditional Generative Adversarial Refinement Networks for Unbalanced Medical Image Semantic Segmentation,10.1109/wacv.2019.00200,2019,BRATS
Brainlesion: Glioma Multiple Sclerosis Stroke and Traumatic Brain Injuries,10.1007/978-3-319-75238-9,2018,BRATS
A Deep Learning for Brain Tumor MRI Images Semantic Segmentation Using FCN,10.1109/ccaa.2018.8777675,2018,BRATS
A hybrid of active contour model and convex hull for automated brain tumor segmentation in multimodal MRI,10.1007/s11042-019-08048-4,2019,BRATS
Radiogenomic analysis of vascular endothelial growth factor in patients with diffuse gliomas,10.1186/s40644-019-0256-y,2019,BRATS
Current research opportunities of image processing and computer vision,10.7494/csci.2019.20.4.3163,2019,BRATS
A novel systematic approach to diagnose brain tumor using integrated type-II fuzzy logic and ANFIS (adaptive neuro-fuzzy inference system) model,10.1007/s00500-019-04635-7,2020,BRATS
Three-Plane–assembled Deep Learning Segmentation of Gliomas,10.1148/ryai.2020190011,2020,BRATS
A Deep Learning Approach Towards Railway Safety Risk Assessment,10.1109/access.2020.2997946,2020,BRATS
Unified generative adversarial networks for multimodal segmentation from unpaired 3D medical images,10.1016/j.media.2020.101731,2020,BRATS
The Application of Deep Convolutional Neural Networks to Brain Cancer Images: A Survey,10.3390/jpm10040224,2020,BRATS
TuNet: End-to-End Hierarchical Brain Tumor Segmentation Using Cascaded Networks,10.1007/978-3-030-46640-4_17,2019,BRATS
DeepKeyGen: A Deep Learning-Based Stream Cipher Generator for Medical Image Encryption and Decryption,10.1109/tnnls.2021.3062754,2021,BRATS
Visual interpretability in 3D brain tumor segmentation network,10.1016/j.compbiomed.2021.104410,2021,BRATS
Fully automated segmentation of brain tumor from multiparametric MRI using 3D context deep supervised U‐Net,10.1002/mp.15032,2021,BRATS
Multimodal Self-supervised Learning for Medical Image Analysis,10.1007/978-3-030-78191-0_51,2019,BRATS
Attention Res-UNet with Guided Decoder for semantic segmentation of brain tumors,10.1016/j.bspc.2021.103077,2022,BRATS
Deep reinforcement learning in computer vision: a comprehensive survey,10.1007/s10462-021-10061-9,2021,BRATS
Deep Learning for Smart Healthcare—A Survey on Brain Tumor Detection from Medical Imaging,10.3390/s22051960,2022,BRATS
Unsupervised brain imaging 3D anomaly detection and segmentation with transformers,10.1016/j.media.2022.102475,2022,BRATS
Image Features for Brain Lesion Segmentation Using Random Forests,10.1007/978-3-319-30858-6_11,2015,BRATS
Automated brain tumor segmentation using kernel dictionary learning and superpixel-level features,10.1109/smc.2016.7844622,2016,BRATS
Progressive disease in glioblastoma: Benefits and limitations of semi-automated volumetry,10.1371/journal.pone.0173112,2017,BRATS
Deep Neural Network with l2-Norm Unit for Brain Lesions Detection,10.1007/978-3-319-70093-9_85,2017,BRATS
Volumetric brain tumour detection from MRI using visual saliency,10.1371/journal.pone.0187209,2017,BRATS
Deep Generative Models in the Real-World: An Open Challenge from Medical  Imaging,10.48550/arxiv.1806.05452,2018,BRATS
Radiomics derived from amino-acid PET and conventional MRI in patients with high-grade gliomas,10.23736/s1824-4785.18.03095-9,2018,BRATS
ENS-Unet: End-to-End Noise Suppression U-Net for Brain Tumor Segmentation,10.1109/embc.2018.8513676,2018,BRATS
Glioma Segmentation and a Simple Accurate Model for Overall Survival Prediction,10.1007/978-3-030-11726-9_42,2018,BRATS
Glioma grading using structural magnetic resonance imaging and molecular data,10.1117/1.jmi.6.2.024501,2019,BRATS
Data Augmentation via Image Registration,10.1109/icip.2019.8803423,2019,BRATS
Brain Tumor Segmentation with Generative Adversarial Nets,10.1109/icaibd.2019.8836968,2019,BRATS
CoCa-GAN: Common-Feature-Learning-Based Context-Aware Generative Adversarial Network for Glioma Grading,10.1007/978-3-030-32248-9_18,2019,BRATS
Ultrasound Bone Segmentation: A Scoping Review of Techniques and Validation Practices,10.1016/j.ultrasmedbio.2019.12.014,2020,BRATS
Sample-Adaptive GANs: Linking Global and Local Mappings for Cross-Modality MR Image Synthesis,10.1109/tmi.2020.2969630,2020,BRATS
When Deep Learning Meets Data Alignment: A Review on Deep Registration Networks (DRNs),10.3390/app10217524,2020,BRATS
Path aggregation U-Net model for brain tumor segmentation,10.1007/s11042-020-08795-9,2020,BRATS
Transfer Learning Based Brain Tumor Detection and Segmentation using Superpixel Technique,10.1109/ic3a48958.2020.233306,2020,BRATS
Primary Central Nervous System Lymphoma: Clinical Evaluation of Automated Segmentation on Multiparametric <scp>MRI</scp> Using Deep Learning,10.1002/jmri.27288,2020,BRATS
Test-Time Unsupervised Domain Adaptation,10.1007/978-3-030-59710-8_42,2020,BRATS
Prediction of Glioma Grade using Intratumoral and Peritumoral Radiomic Features from Multiparametric MRI Images,10.1109/tcbb.2020.3033538,2020,BRATS
A stochastic multi-agent approach for medical-image segmentation: Application to tumor segmentation in brain MR images,10.1016/j.artmed.2020.101980,2020,BRATS
CardioNet: a manually curated database for artificial intelligence-based research on cardiovascular diseases,10.1186/s12911-021-01392-2,2021,BRATS
Application of deep learning for automatic segmentation of brain tumors on magnetic resonance imaging: a heuristic approach in the clinical scenario,10.1007/s00234-021-02649-3,2021,BRATS
H$$^2$$NF-Net for Brain Tumor Segmentation Using Multimodal MR Imaging: 2nd Place Solution to BraTS Challenge 2020 Segmentation Task,10.1007/978-3-030-72087-2_6,2020,BRATS
Modality-Aware Mutual Learning for Multi-modal Medical Image Segmentation,10.1007/978-3-030-87193-2_56,2021,BRATS
Brain extraction in pediatric ADC maps toward characterizing neuro-development in multi-platform and multi-institution clinical images,10.1016/j.neuroimage.2015.08.002,2015,BRATS
A picture fuzzy clustering approach for brain tumor segmentation,10.1109/ccip.2016.7802852,2016,BRATS
Improved brain tumor segmentation by utilizing tumor growth model in longitudinal brain MRI,10.1117/12.2254034,2017,BRATS
Fast and robust brain tumor segmentation using level set method with multiple image information,10.3233/xst-17261,2017,BRATS
Multi-task Fully Convolutional Network for Brain Tumour Segmentation,10.1007/978-3-319-60964-5_21,2017,BRATS
An efficient and automatic glioblastoma brain tumor detection using shift-invariant shearlet transform and neural networks,10.1002/ima.22227,2017,BRATS
3D Brain Tumor Segmentation Through Integrating Multiple 2D FCNNs,10.1007/978-3-319-75238-9_17,2017,BRATS
Brain Tumor Segmentation in MRI Scans Using Deeply-Supervised Neural Networks,10.1007/978-3-319-75238-9_28,2017,BRATS
Pooling-Free Fully Convolutional Networks with Dense Skip Connections for Semantic Segmentation with Application to Brain Tumor Segmentation,10.1007/978-3-319-75238-9_15,2017,BRATS
Improving the estimation of prognosis for glioblastoma patients by MR based hemodynamic tissue signatures,10.1002/nbm.4006,2018,BRATS
Prediction of 1p/19q Codeletion in Diffuse Glioma Patients Using Pre-operative Multiparametric Magnetic Resonance Imaging,10.3389/fncom.2019.00052,2019,BRATS
A multispectral camera system for automated minirhizotron image analysis,10.1007/s11104-019-04132-8,2019,BRATS
Brain structural disorders detection and classification approaches: a review,10.1007/s10462-019-09766-9,2020,BRATS
Robustness of Radiomics for Survival Prediction of Brain Tumor Patients Depending on Resection Status,10.3389/fncom.2019.00073,2019,BRATS
Mining multi-site clinical data to develop machine learning MRI biomarkers: application to neonatal hypoxic ischemic encephalopathy,10.1186/s12967-019-2119-5,2019,BRATS
Improving brain tumor segmentation on MRI based on the deep U-net and residual units,10.3233/xst-190552,2020,BRATS
Fractional mesh-free linear diffusion method for image enhancement and segmentation for automatic tumor classification,10.1016/j.bspc.2019.101841,2020,BRATS
Multi-level Glioma Segmentation using 3D U-Net Combined Attention Mechanism with Atrous Convolution,10.1109/bibm47256.2019.8983092,2019,BRATS
Brain Tumor Segmentation with Uncertainty Estimation and Overall Survival Prediction,10.1007/978-3-030-46640-4_29,2019,BRATS
Brain Tumor Classification Using 3D Convolutional Neural Network,10.1007/978-3-030-46643-5_33,2019,BRATS
Multi-resolution 3D CNN for MRI Brain Tumor Segmentation and Survival Prediction,10.1007/978-3-030-46640-4_21,2019,BRATS
Brain Tumor Synthetic Segmentation in 3D Multimodal MRI Scans,10.1007/978-3-030-46640-4_15,2019,BRATS
Glioma Classification Using Deep Radiomics,10.1007/s42979-020-00214-y,2020,BRATS
Incremental Dilations Using CNN for Brain Tumor Classification,10.3390/app10144915,2020,BRATS
Convolutional neural networks for head and neck tumor segmentation on 7-channel multiparametric MRI: a leave-one-out analysis,10.1186/s13014-020-01618-z,2020,BRATS
Smart Identification of Topographically Variant Anomalies in Brain Magnetic Resonance Imaging Using a Fish School-Based Fuzzy Clustering Approach,10.1109/tfuzz.2020.3015591,2021,BRATS
Diffusion and perfusion MRI radiomics obtained from deep learning segmentation provides reproducible and comparable diagnostic model to human in post-treatment glioblastoma,10.1007/s00330-020-07414-3,2021,BRATS
Advancements in Neuroimaging to Unravel Biological and Molecular Features of Brain Tumors,10.3390/cancers13030424,2021,BRATS
WITHDRAWN: Experimental analysis of brain tumor detection system using Machine learning approach,10.1016/j.matpr.2021.01.246,2021,BRATS
Construction of a prognostic immune signature for lower grade glioma that can be recognized by MRI radiomics features to predict survival in LGG patients,10.1016/j.tranon.2021.101065,2021,BRATS
DFP-ResUNet:Convolutional Neural Network with a Dilated Convolutional Feature Pyramid for Multimodal Brain Tumor Segmentation,10.1016/j.cmpb.2021.106208,2021,BRATS
Brain tumor image segmentation via asymmetric/symmetric UNet based on two-pathway-residual blocks,10.1016/j.bspc.2021.102841,2021,BRATS
MRI-based Identification and Classification of Major Intracranial Tumor Types by Using a 3D Convolutional Neural Network: A Retrospective Multi-institutional Analysis,10.1148/ryai.2021200301,2021,BRATS
Brain Tumor Detection and Classification on MR Images by a Deep Wavelet Auto-Encoder Model,10.3390/diagnostics11091589,2021,BRATS
A framework for optimal kernel-based manifold embedding of medical image data,10.1016/j.compmedimag.2014.06.001,2015,BRATS
Computational Challenges and Collaborative Projects in the NCI Quantitative Imaging Network,10.18383/j.tom.2016.00265,2016,BRATS
A Fuzzy clustering based MRI brain image segmentation using back propagation neural networks,10.1007/s10586-017-1613-x,2019,BRATS
Using deep neural networks for radiogenomic analysis,10.1109/isbi.2018.8363864,2018,BRATS
A Glioma Segmentation Method Using CoTraining and Superpixel-Based Spatial and Clinical Constraints,10.1109/access.2018.2873674,2018,BRATS
Lesion focused super-resolution,10.1117/12.2512576,2019,BRATS
Automatic Brain Tumor Segmentation with Domain Adaptation,10.1007/978-3-030-11726-9_34,2018,BRATS
Automatic Brain Tumor Segmentation and Overall Survival Prediction Using Machine Learning Algorithms,10.1007/978-3-030-11726-9_36,2018,BRATS
Deep Hourglass for Brain Tumor Segmentation,10.1007/978-3-030-11726-9_37,2018,BRATS
Brain Tumor Segmentation and Survival Prediction Using a Cascade of Random Forests,10.1007/978-3-030-11726-9_30,2018,BRATS
3D Hyper-Dense Connected Convolutional Neural Network for Brain Tumor Segmentation,10.1109/skg.2018.00024,2018,BRATS
Glioma extraction from MR images employing Gradient Based Kernel Selection Graph Cut technique,10.1007/s00371-019-01698-3,2020,BRATS
A Machine Learning Approach to Brain Tumors Segmentation Using Adaptive Random Forest Algorithm,10.1109/kbei.2019.8735072,2019,BRATS
A Bi-Attention Adversarial Network for Prostate Cancer Segmentation,10.1109/access.2019.2939389,2019,BRATS
Denoising and contrast-enhancement approach of magnetic resonance imaging glioblastoma brain tumors,10.1117/1.jmi.6.4.044002,2019,BRATS
Divide and Conquer: Stratifying Training Data by Tumor Grade Improves Deep Learning-Based Brain Tumor Segmentation.,10.3389/fnins.2019.01182,2019,BRATS
Anatomically consistent CNN-based segmentation of organs-at-risk in cranial radiotherapy,10.1117/1.jmi.7.1.014502,2020,BRATS
Di‐phase midway convolution and deconvolution network for brain tumor segmentation in MRI images,10.1002/ima.22407,2020,BRATS
Brain MR Image Classification for Glioma Tumor detection using Deep Convolutional Neural Network Features,10.2174/1573405616666200311122429,2021,BRATS
Artificial Intelligence in Clinical Neuroscience: Methodological and Ethical Challenges,10.1080/21507740.2020.1740352,2020,BRATS
IOUC-3DSFCNN: Segmentation of Brain Tumors via IOU Constraint 3D Symmetric Full Convolution Network with Multimodal Auto-context,10.1038/s41598-020-63242-x,2020,BRATS
Two-Step U-Nets for Brain Tumor Segmentation and Random Forest with Radiomics for Survival Time Prediction,10.1007/978-3-030-46640-4_19,2019,BRATS
DCU-Net: Multi-scale U-Net for brain tumor segmentation,10.3233/xst-200650,2020,BRATS
Frequency Domain Compact 3D Convolutional Neural Networks,10.1109/cvpr42600.2020.00171,2020,BRATS
Combining analysis of multi-parametric MR images into a convolutional neural network: Precise target delineation for vestibular schwannoma treatment planning,10.1016/j.artmed.2020.101911,2020,BRATS
How Reliable Are Volumetric Techniques for High-Grade Gliomas? A Comparison Study of Different Available Tools,10.1093/neuros/nyaa282,2020,BRATS
A Precise Analysis of Deep Learning for Medical Image Processing,10.1007/978-981-15-5495-7_2,2021,BRATS
Learning joint segmentation of tissues and brain lesions from task-specific hetero-modal domain-shifted datasets,10.1016/j.media.2020.101862,2021,BRATS
Medical deep learning—A systematic meta-review,10.1016/j.cmpb.2022.106874,2022,BRATS
Memory-efficient GAN-based domain translation of high resolution 3D medical images,10.1016/j.compmedimag.2020.101801,2020,BRATS
Analyzing magnetic resonance imaging data from glioma patients using deep learning,10.1016/j.compmedimag.2020.101828,2021,BRATS
Surgical planning of pelvic tumor using multi-view CNN with relation-context representation learning,10.1016/j.media.2020.101954,2021,BRATS
Ophthalmic Magnetic Resonance Imaging: Where Are We (Heading To)?,10.1080/02713683.2021.1874021,2021,BRATS
LR-cGAN: Latent representation based conditional generative adversarial network for multi-modality MRI synthesis,10.1016/j.bspc.2021.102457,2021,BRATS
Survival of glioblastoma in relation to tumor location: a statistical tumor atlas of a population-based cohort,10.1007/s00701-021-04802-6,2021,BRATS
Comparison of metrics for the evaluation of medical segmentations using prostate MRI dataset,10.1016/j.compbiomed.2021.104497,2021,BRATS
Artificial Intelligence Applications in Pediatric Brain Tumor Imaging: A Systematic Review,10.1016/j.wneu.2021.10.068,2022,BRATS
Decentralized Federated Learning for Healthcare Networks: A Case Study on Tumor Segmentation,10.1109/access.2022.3141913,2022,BRATS
Literature review: efficient deep neural networks techniques for medical image analysis,10.1007/s00521-022-06960-9,2022,BRATS
Classification of brain tumours in MR images using deep spatiospatial models,10.1038/s41598-022-05572-6,2022,BRATS
An overview of deep learning methods for multimodal medical data mining,10.1016/j.eswa.2022.117006,2022,BRATS
Global-Local Transformer for Brain Age Estimation,10.1109/tmi.2021.3108910,2022,BRATS
Glioma Prognosis: Segmentation of the Tumor and Survival Prediction Using Shape Geometric and Clinical Information,10.1007/978-3-030-11726-9_13,2019,BRATS
MiMSeg - an algorithm for automated detection of tumor tissue on NMR apparent diffusion coefficient maps.,10.1016/j.ins.2016.07.052,2017,BRATS
Shanoir: Applying the Software as a Service Distribution Model to Manage Brain Imaging Research Repositories,10.3389/fict.2016.00025,2016,BRATS
A joint intensity and edge magnitude-based multilevel thresholding algorithm for the automatic segmentation of pathological MR brain images,10.1007/s00521-016-2751-4,2018,BRATS
Lifted Auto-Context Forests for Brain Tumour Segmentation,10.1007/978-3-319-55524-9_17,2016,BRATS
Multiclass brain Glioma tumor classification using block-based 3D Wavelet features of MR images,10.1109/iceee2.2017.7935845,2017,BRATS
Tumor Segmentation from Multimodal MRI Using Random Forest with Superpixel and Tensor Based Feature Extraction,10.1007/978-3-319-75238-9_39,2017,BRATS
Evolutionary intelligence for brain tumor recognition from MRI images: a critical study and review,10.1007/s12065-018-0156-2,2018,BRATS
Semantic Segmentation Using Deep Learning for Brain Tumor MRI via Fully Convolution Neural Networks,10.1007/978-981-13-1742-2_2,2019,BRATS
Brain Tumor Segmentation Using Bit-plane and UNET,10.1007/978-3-030-11726-9_41,2018,BRATS
Extending 2D Deep Learning Architectures to 3D Image Segmentation Problems,10.1007/978-3-030-11726-9_7,2018,BRATS
A Deep Learning Pipeline for Automatic Skull Stripping and Brain Segmentation,10.1109/isbi.2019.8759465,2019,BRATS
Prostate Cancer Detection and Segmentation in Multi-parametric MRI via CNN and Conditional Random Field,10.1109/isbi.2019.8759584,2019,BRATS
One-to-one Mapping for Unpaired Image-to-image Translation,10.1109/wacv45572.2020.9093622,2020,BRATS
U-Net Based Glioblastoma Segmentation with Patient’s Overall Survival Prediction,10.1007/978-3-030-43364-2_3,2020,BRATS
Manual segmentation versus semi-automated segmentation for quantifying vestibular schwannoma volume on MRI,10.1007/s11548-020-02222-y,2020,BRATS
Brain Tumor Classification with Tumor Segmentations and a Dual Path Residual Convolutional Neural Network from MRI and Pathology Images,10.1007/978-3-030-46643-5_36,2019,BRATS
Automatic Brain Tumour Segmentation and Biophysics-Guided Survival Prediction,10.1007/978-3-030-46643-5_6,2019,BRATS
Whale Harris hawks optimization based deep learning classifier for brain tumor detection using MRI images,10.1016/j.jksuci.2020.08.006,2020,BRATS
MGMT methylation may benefit overall survival in patients with moderately vascularized glioblastomas.,10.1007/s00330-020-07297-4,2021,BRATS
Theoretical analysis and experimental validation of volume bias of soft Dice optimized segmentation maps in the context of inherent uncertainty,10.1016/j.media.2020.101833,2021,BRATS
Importance and Evidence of Extent of Resection in Glioblastoma,10.1055/s-0040-1701635,2021,BRATS
