name,DOI,publication_year,dataset_used
MRI Brain Tumor Segmentation Using a 2D-3D U-Net Ensemble,10.1007/978-3-030-72084-1_32,2020,BRATS
Automatic Segmentation of Non-tumor Tissues in Glioma MR Brain Images Using Deformable Registration with Partial Convolutional Networks,10.1007/978-3-030-72084-1_4,2020,BRATS
Overall Survival Prediction for Glioblastoma on Pre-treatment MRI Using Robust Radiomics and Priors,10.1007/978-3-030-72084-1_28,2020,BRATS
Brain Tumor Segmentation Using Dual-Path Attention U-Net in 3D MRI Images,10.1007/978-3-030-72084-1_17,2020,BRATS
PieceNet: A Redundant UNet Ensemble,10.1007/978-3-030-72087-2_29,2020,BRATS
Multi-threshold Attention U-Net (MTAU) Based Model for Multimodal Brain Tumor Segmentation in MRI Scans,10.1007/978-3-030-72087-2_15,2020,BRATS
Glioma Segmentation Using Encoder-Decoder Network and Survival Prediction Based on Cox Analysis,10.1007/978-3-030-72084-1_29,2020,BRATS
Glioma Sub-region Segmentation on Multi-parameter MRI with Label Dropout,10.1007/978-3-030-72087-2_37,2020,BRATS
3D Brain Tumor Segmentation and Survival Prediction Using Ensembles of Convolutional Neural Networks,10.1007/978-3-030-72087-2_21,2020,BRATS
Multimodal Brain Image Analysis and Survival Prediction Using Neuromorphic Attention-Based Neural Networks,10.1007/978-3-030-72084-1_18,2020,BRATS
Brain Tumor Segmentation and Survival Prediction using 3D Attention UNet,10.48550/arxiv.2104.00985,2021,BRATS
Transfer Learning for Brain Tumor Segmentation,10.1007/978-3-030-72084-1_22,2020,BRATS
Cerberus: A Multi-headed Network for Brain Tumor Segmentation,10.1007/978-3-030-72087-2_30,2020,BRATS
Self-training for Brain Tumour Segmentation with Uncertainty Estimation and Biophysics-Guided Survival Prediction,10.1007/978-3-030-72084-1_46,2020,BRATS
A Framework Based on Metabolic Networks and Biomedical Images Data to Discriminate Glioma Grades,10.1007/978-3-030-72379-8_9,2020,BRATS
Brain Tumour Segmentation Using Probabilistic U-Net,10.1007/978-3-030-72087-2_22,2020,BRATS
Memory Efficient 3D U-Net with Reversible Mobile Inverted Bottlenecks for Brain Tumor Segmentation,10.1007/978-3-030-72087-2_34,2021,BRATS
Model for Enhancement and Segmentation of Magnetic Resonance Images for Brain Tumor Classification,10.1134/s1054661821010065,2021,BRATS
Improving performance and generalizability in radiogenomics: a pilot study for prediction of IDH1/2 mutation status in gliomas with multicentric data,10.1117/1.jmi.8.3.031905,2021,BRATS
Brain volumetric and fractal analysis of synthetic MRI: A comparative study with conventional 3D T1-weighted images,10.1016/j.ejrad.2021.109782,2021,BRATS
Graph Laplacian-based Tumor Segmentation and Denoising in Brain Magnetic Resonance Imaging,10.1109/ieeeconf51394.2020.9443557,2020,BRATS
3D brain glioma segmentation in MRI through integrating multiple densely connected 2D convolutional neural networks,10.1631/jzus.b2000381,2021,BRATS
Classification of brain tumor from magnetic resonance images using probabilistic features and possibilistic Hanman–Shannon transform classifier,10.1002/ima.22619,2021,BRATS
GA-based multi-objective optimization technique for medical image denoising in wavelet domain,10.3233/jifs-210429,2021,BRATS
Accurate Automatic Glioma Segmentation in Brain MRI images Based on CapsNet,10.1101/2021.07.03.450931,2021,BRATS
Harmony Loss for Unbalanced Prediction,10.1109/jbhi.2021.3094578,2022,BRATS
Learning rich features with hybrid loss for brain tumor segmentation,10.1186/s12911-021-01431-y,2021,BRATS
CASPIANET++: A multidimensional Channel-Spatial Asymmetric attention network with Noisy Student Curriculum Learning paradigm for brain tumor segmentation,10.1016/j.compbiomed.2021.104690,2021,BRATS
Projected Gradient Method Combined with Homotopy Techniques for Volume-Measure-Preserving Optimal Mass Transportation Problems,10.1007/s10915-021-01583-z,2021,BRATS
Glioma segmentation of optimized 3D U-net and prediction of multi-modal survival time,10.1007/s00521-021-06351-6,2021,BRATS
A positive/unlabeled approach for the segmentation of medical sequences using point-wise supervision,10.1016/j.media.2021.102185,2021,BRATS
Enhanced Magnetic Resonance Image Synthesis with Contrast-Aware Generative Adversarial Networks,10.3390/jimaging7080133,2021,BRATS
Normative ascent with local gaussians for unsupervised lesion detection,10.1016/j.media.2021.102208,2021,BRATS
3D dense convolutional neural network for fast and accurate single MR image super-resolution,10.1016/j.compmedimag.2021.101973,2021,BRATS
Superpixel/voxel medical image segmentation algorithm based on the regional interlinked value,10.1007/s10044-021-01021-8,2021,BRATS
Generative models improve radiomics performance in different tasks and different datasets: An experimental study,10.1016/j.ejmp.2022.04.008,2022,BRATS
Açıklanabilir Evrişimsel Sinir Ağları ile Beyin Tümörü Tespiti,10.31202/ecjse.924446,2021,BRATS
Robustifying Deep Networks for Medical Image Segmentation,10.1007/s10278-021-00507-5,2021,BRATS
On the Relationship Between Calibrated Predictors and Unbiased Volume Estimation,10.1007/978-3-030-87193-2_64,2021,BRATS
Deep variational clustering framework for self-labeling large-scale medical images,10.1117/12.2613331,2022,BRATS
CCT-Net: Category-Invariant Cross-Domain Transfer for Medical Single-to-Multiple Disease Diagnosis,10.1109/iccv48922.2021.00815,2021,BRATS
Asymmetric Ensemble of Asymmetric U-Net Models for Brain Tumor Segmentation With Uncertainty Estimation,10.3389/fneur.2021.609646,2021,BRATS
Robust joint registration of multiple stains and MRI for multimodal 3D histology reconstruction: Application to the Allen human brain atlas,10.1016/j.media.2021.102265,2022,BRATS
Hierarchical-order multimodal interaction fusion network for grading gliomas,10.1088/1361-6560/ac30a1,2021,BRATS
An Interval Iteration Based Multilevel Thresholding Algorithm for Brain MR Image Segmentation,10.3390/e23111429,2021,BRATS
Computer Vision in the Infrared Spectrum: Challenges and Approaches,10.2200/s01127ed1v01y202109cov019,2021,BRATS
<scp>GAN‐segNet</scp> : A deep generative adversarial segmentation network for brain tumor semantic segmentation,10.1002/ima.22677,2021,BRATS
3D hierarchical dual-attention fully convolutional networks with hybrid losses for diverse glioma segmentation,10.1016/j.knosys.2021.107692,2021,BRATS
Towards an Architecture of a Multi-purpose User-Extendable Reference Human Brain Atlas.,10.1007/s12021-021-09555-2,2021,BRATS
Improving the Segmentation of Pediatric Low-Grade Gliomas Through Multitask Learning,10.1109/embc48229.2022.9871627,2021,BRATS
Enhanced performance of Dark-Nets for brain tumor classification and segmentation using colormap-based superpixel techniques,10.1016/j.mlwa.2021.100212,2022,BRATS
Brain Tumor Segmentation using Community Detection Algorithm,10.1109/cw52790.2021.00016,2021,BRATS
VGG-UNET for Brain Tumor Segmentation and Ensemble Model for Survival Prediction,10.1109/icrai54018.2021.9651367,2021,BRATS
Cross-Modal Distillation to Improve MRI-Based Brain Tumor Segmentation With Missing MRI Sequences,10.1109/tbme.2021.3137561,2021,BRATS
Object Detection Improves Tumour Segmentation in MR Images of Rare Brain Tumours,10.3390/cancers13236113,2021,BRATS
Trends in Development of Novel Machine Learning Methods for the Identification of Gliomas in Datasets That Include Non-Glioma Images: A Systematic Review,10.3389/fonc.2021.788819,2021,BRATS
Radiomics and Qualitative Features From Multiparametric MRI Predict Molecular Subtypes in Patients With Lower-Grade Glioma,10.3389/fonc.2021.756828,2022,BRATS
Secure Collaborative Augmented Reality Framework for Biomedical Informatics,10.1109/jbhi.2021.3139575,2021,BRATS
Brain Tumor Detection Using Various Deep Learning Algorithms,10.1109/icsct53883.2021.9642649,2021,BRATS
Deep Learning–based Automatic Lung Segmentation on Multiresolution CT Scans from Healthy and Fibrotic Lungs in Mice,10.1148/ryai.210095,2022,BRATS
A Survey: Brain Tumor Detection Using MRI Image with Deep Learning Techniques,10.1002/9781119682554.ch6,2022,BRATS
A Review: Recent Automatic Algorithms for the Segmentation of Brain Tumor MRI,10.1007/978-3-030-90618-4_25,2022,BRATS
Brain MR Atlas Construction Using Symmetric Deep Neural Inpainting,10.1109/jbhi.2022.3149754,2022,BRATS
Detection of Brain Tumor Abnormality from MRI FLAIR Images using Machine Learning Techniques,10.1007/s40031-022-00721-x,2022,BRATS
Magnetic resonance imaging contrast enhancement synthesis using cascade networks with local supervision,10.1002/mp.15578,2022,BRATS
Kidney Tumor Semantic Segmentation Using Deep Learning: A Survey of State-of-the-Art,10.3390/jimaging8030055,2022,BRATS
Ensembles of Convolutional Neural Networks for Survival Time Estimation of High-Grade Glioma Patients from Multimodal MRI,10.3390/diagnostics12020345,2022,BRATS
State-of-the-art techniques using pre-operative brain MRI scans for survival prediction of glioblastoma multiforme patients and future research directions,10.1007/s40336-022-00487-8,2022,BRATS
An Improved 3D Deep Learning-Based Segmentation of Left Ventricular Myocardial Diseases from Delayed-Enhancement MRI with Inclusion and Classification Prior Information U-Net (ICPIU-Net),10.3390/s22062084,2022,BRATS
Magnetic resonance image-based brain tumour segmentation methods: A systematic review,10.1177/20552076221074122,2022,BRATS
Unsupervised domain adaptation for segmentation with black-box source model,10.1117/12.2607895,2022,BRATS
Category guided attention network for brain tumor segmentation in MRI,10.1088/1361-6560/ac628a,2022,BRATS
Fractional probabilistic fuzzy clustering and optimization based brain tumor segmentation and classification,10.1007/s11042-022-11969-2,2022,BRATS
Image analyses for engineering advanced tissue biomanufacturing processes,10.1016/j.biomaterials.2022.121514,2022,BRATS
Deep learning‐based 3D MRI contrast‐enhanced synthesis from a 2D noncontrast T2Flair sequence,10.1002/mp.15636,2022,BRATS
Segmentation and classification of brain tumors from MRI images based on adaptive mechanisms and ELDP feature descriptor,10.1016/j.bspc.2022.103704,2022,BRATS
Explainability of deep neural networks for MRI analysis of brain tumors,10.1007/s11548-022-02619-x,2022,BRATS
Synthetic MRI improves radiomics‐based glioblastoma survival prediction,10.1002/nbm.4754,2022,BRATS
Intensity standardization of MRI prior to radiomic feature extraction for artificial intelligence research in glioma—a systematic review,10.1007/s00330-022-08807-2,2022,BRATS
Common feature learning for brain tumor MRI synthesis by context-aware generative adversarial network,10.1016/j.media.2022.102472,2022,BRATS
Brain tumor segmentation based on region of interest-aided localization and segmentation U-Net,10.1007/s13042-022-01536-4,2022,BRATS
Supervised segmentation with domain adaptation for small sampled orbital CT images,10.1093/jcde/qwac029,2022,BRATS
SGEResU-Net for brain tumor segmentation,10.3934/mbe.2022261,2022,BRATS
CTV Delineation for High-Grade Gliomas: Is There Agreement With Tumor Cell Invasion Models?,10.1016/j.adro.2022.100987,2022,BRATS
A Review on Convolutional Neural Networks for Brain Tumor Segmentation: Methods Datasets Libraries and Future Directions,10.1016/j.irbm.2022.05.002,2022,BRATS
Markov Clustering Based Feature Selection for Brain Tumor Segmentation from Multi-Spectral MRI Records,10.1109/sami54271.2022.9780855,2022,BRATS
Machine Learning for the Detection and Segmentation of Benign Tumors of the Central Nervous System: A Systematic Review,10.3390/cancers14112676,2022,BRATS
Radiomics and radiogenomics in pediatric neuro-oncology: A review,10.1093/noajnl/vdac083,2022,BRATS
Spectroscopic imaging of D-2-hydroxyglutarate and other metabolites in pre-surgical patients with IDH-mutant lower-grade gliomas,10.1007/s11060-022-04042-3,2022,BRATS
scSE-NL V-Net: A Brain Tumor Automatic Segmentation Method Based on Spatial and Channel “Squeeze-and-Excitation” Network With Non-local Block,10.3389/fnins.2022.916818,2022,BRATS
A modified convolutional neural network architecture for diabetic retinopathy screening using SVDD,10.1016/j.asoc.2022.109102,2022,BRATS
An improved multi-modal joint segmentation and registration model based on Bhattacharyya distance measure,10.1016/j.aej.2022.06.018,2022,BRATS
Minimally parametrized segmentation framework with dual metaheuristic optimisation algorithms and FCM for detection of anomalies in MR brain images,10.1016/j.bspc.2022.103866,2022,BRATS
A state-of-the-art technique to perform cloud-based semantic segmentation using deep learning 3D U-Net architecture,10.1186/s12859-022-04794-9,2022,BRATS
Deep learning for fast low-field MRI acquisitions,10.1038/s41598-022-14039-7,2022,BRATS
Deep learning for prediction of isocitrate dehydrogenase mutation in gliomas: a critical approach systematic review and meta-analysis of the diagnostic test performance using a Bayesian approach,10.21037/qims-22-34,2021,BRATS
CSU-Net: A CNN-Transformer Parallel Network for Multimodal Brain Tumour Segmentation,10.3390/electronics11142226,2022,BRATS
A Feasibility Study on Deep Learning Based Brain Tumor Segmentation Using 2D Ellipse Box Areas,10.3390/s22145292,2022,BRATS
Multimodal Brain Tumor Segmentation Using a 3D ResUNet in BraTS 2021,10.1007/978-3-031-08999-2_26,2022,BRATS
Ensemble CNN Networks for GBM Tumors Segmentation Using Multi-parametric MRI,10.1007/978-3-031-08999-2_41,2022,BRATS
Reciprocal Adversarial Learning for Brain Tumor Segmentation: A Solution to BraTS Challenge 2021 Segmentation Task,10.1007/978-3-031-08999-2_13,2022,BRATS
LKAU-Net: 3D Large-Kernel Attention-Based U-Net for Automatic MRI Brain Tumor Segmentation,10.1007/978-3-031-12053-4_24,2022,BRATS
Applications of Artificial Intelligence Based on Medical Imaging in Glioma: Current State and Future Challenges,10.3389/fonc.2022.892056,2022,BRATS
Artificial intelligence in the radiomic analysis of glioblastomas: A review taxonomy and perspective,10.3389/fonc.2022.924245,2022,BRATS
An Exhaustive Analytical Study of U-Net Architecture on Two Diverse Biomedical Imaging Datasets of Electron Microscopy Drosophila ssTEM and Brain MRI BraTS-2021 for Segmentation,10.1007/s42979-022-01347-y,2022,BRATS
MRF-IUNet: A Multiresolution Fusion Brain Tumor Segmentation Network Based on Improved Inception U-Net,10.1155/2022/6305748,2022,BRATS
Methods to Recognize Depth of Hard Inclusions in Soft Tissue Using Ordinal Classification for Robotic Palpation,10.1109/tim.2022.3198765,2022,BRATS
Deep evidential fusion network for medical image classification,10.1016/j.ijar.2022.08.013,2022,BRATS
Visual ensemble selection of deep convolutional neural networks for 3D segmentation of breast tumors on dynamic contrast enhanced MRI,10.1007/s00330-022-09113-7,2022,BRATS
A medical image segmentation method based on multi-dimensional statistical features,10.3389/fnins.2022.1009581,2022,BRATS
Edge U-Net: Brain tumor segmentation using MRI based on deep U-Net model with boundary information,10.1016/j.eswa.2022.118833,2022,BRATS
The federated tumor segmentation (FeTS) tool: an open-source solution to further solid tumor research,10.1088/1361-6560/ac9449,2022,BRATS
The University of California San Francisco Preoperative Diffuse Glioma MRI Dataset,10.1148/ryai.220058,2022,BRATS
MBANet: A 3D convolutional neural network with multi-branch attention for brain tumor segmentation from MRI images,10.1016/j.bspc.2022.104296,2023,BRATS
Multiscale lightweight 3D segmentation algorithm with attention mechanism: Brain tumor image segmentation,10.1016/j.eswa.2022.119166,2023,BRATS
Entropy-Based Automatic Segmentation and Extraction of Tumors from Brain MRI Images,10.1007/978-3-319-23117-4_17,2015,BRATS
An untrained and unsupervised method for MRI brain tumor segmentation,10.1109/isbi.2016.7493260,2016,BRATS
Clustering of MRI Radiomics Features for Glioblastoma Multiforme: An Initial Study,10.1007/978-3-319-43775-0_28,2016,BRATS
Multi-modal Brain Tumor Segmentation Based on Self-organizing Active Contour Model,10.1007/978-981-10-3005-5_40,2016,BRATS
Use Case II: Imaging Biomarkers and New Trends for Integrated Glioblastoma Management,10.1007/978-3-319-43504-6_16,2017,BRATS
Boundary overlap for medical image segmentation evaluation,10.1117/12.2254496,2017,BRATS
Play for Me: Image Segmentation via Seamless Playsourcing,10.1007/s40869-016-0030-3,2017,BRATS
Review on Machine Learning Based Lesion Segmentation Methods from Brain MR Images,10.1109/icmla.2016.0102,2016,BRATS
Deep learning for segmentation of brain tumors: can we train with images from different institutions?,10.1117/12.2255696,2017,BRATS
Effective user guidance in online interactive semantic segmentation,10.1117/12.2255848,2017,BRATS
Making sense of large data sets without annotations: analyzing age-related correlations from lung CT scans,10.1117/12.2255609,2017,BRATS
Multinomial Level-Set Framework for Multi-region Image Segmentation,10.1007/978-3-319-58771-4_31,2017,BRATS
Multi-level 3D Wavelet Analysis: Application to Brain Tumor Classification,10.1109/icmete.2016.121,2016,BRATS
New Level Set Model in Follow Up Radiotherapy Image Analysis,10.1007/978-3-319-60964-5_24,2017,BRATS
Effective user interaction in online interactive semantic segmentation of glioblastoma magnetic resonance imaging,10.1117/1.jmi.4.3.034001,2017,BRATS
A study on fingerprint image segmentation algorithm,10.1109/iaeac.2017.8054390,2017,BRATS
Fast Barcode Retrieval for Consensus Contouring,10.48550/arxiv.1709.10197,2017,BRATS
Single Image Super-Resolution for MRI Using a Coarse-to-Fine Network,10.1007/978-981-10-7554-4_42,2017,BRATS
Identifying a radiomics imaging signature for prediction of overall survival in glioblastoma multiforme,10.1109/bmeicon.2017.8229098,2017,BRATS
Brain tumor segmentation using wavelet Multi-resolution expectation maximization algorithm,10.1109/intelcis.2017.8260030,2017,BRATS
TuMore: generation of synthetic brain tumor MRI data for deep learning based segmentation approaches,10.1117/12.2315704,2018,BRATS
A joint space‐angle regularization approach for single 4D diffusion image super‐resolution,10.1002/mrm.27184,2018,BRATS
Evaluating the Efficiency of different Feature Sets on Brain Tumor Classification in MR Images,10.5120/ijca2018917008,2018,BRATS
Multi-scale Convolutional-Stack Aggregation for Robust White Matter Hyperintensities Segmentation,10.1007/978-3-030-11723-8_20,2018,BRATS
An Intensity Variation Pattern Analysis Based Machine Learning Classifier for MRI Brain Tumor Detection,10.2174/1573405614666180718122353,2019,BRATS
Performance evaluation of automated brain tumor detection systems with expert delineations and interobserver variability analysis in diseased patients on magnetic resonance imaging,10.1080/08839514.2018.1504500,2018,BRATS
Automatic Liver Tumor Segmentation Based on Random Forest and Fuzzy Clustering,10.1007/978-3-319-91659-0_33,2017,BRATS
Rank-Two NMF Clustering for Glioblastoma Characterization,10.1155/2018/1048164,2018,BRATS
Time-Invariant EEG Classification Based on the Fractal Dimension,10.1007/978-3-030-02840-4_26,2017,BRATS
Comparative Study of Unsupervised Segmentation Algorithms for Delineating Glioblastoma Multiforme Tumour,10.1109/icarm.2018.8610823,2018,BRATS
Multipath Densely Connected Convolutional Neural Network for Brain Tumor Segmentation,10.1007/978-3-030-11723-8_8,2018,BRATS
Segmentation of Post-operative Glioblastoma in MRI by U-Net with Patient-Specific Interactive Refinement,10.1007/978-3-030-11723-8_11,2018,BRATS
Evaluation of Image Processing Methods for Clinical Applications,10.1007/978-3-658-25326-4_5,2019,BRATS
Brain Tumor Detection With Tumor Region Analysis Using Adaptive Thresholding And Morphological Operation,10.1109/ceeict.2018.8628107,2018,BRATS
Brain Ischemic Stroke Segmentation from Brain MRI Between Clustering Methods and Region Based Methods,10.1007/978-3-030-12048-1_16,2018,BRATS
Adaptive Window for Automatic Classification- Based Segmentation of Multimodal Brain Tumor,10.1109/isspit.2018.8642622,2018,BRATS
Brain tumor segmentation based on 3D neighborhood features using rule-based learning,10.1117/12.2523220,2019,BRATS
Learning imbalanced semantic segmentation through cross-domain relations of multi-agent generative adversarial networks,10.1117/12.2512215,2019,BRATS
Prediction of low-grade glioma progression using MR imaging,10.1117/12.2512620,2019,BRATS
Brain Tumor Extraction from MRI Using Clustering Methods and Evaluation of Their Performance,10.1109/iccubea.2018.8697675,2018,BRATS
Comparative study of performing features applied in CNN architectures,10.4108/eai.24-4-2019.2284238,2019,BRATS
Non-parametric Brain Tissues Segmentation via a Parallel Architecture of CNNs,10.1007/978-3-030-21077-9_20,2019,BRATS
Automatic Brain Structures Segmentation Using Deep Residual Dilated  U-Net,10.48550/arxiv.1811.04312,2018,BRATS
Unsupervised Deformable Registration for Multi-Modal Images via  Disentangled Representations,10.48550/arxiv.1903.09331,2019,BRATS
Cerebral edema segmentation using textural feature,10.1016/j.bbe.2019.06.002,2019,BRATS
Brain Tumor Segmentation Using U-Net Based Deep Neural Networks,10.1007/978-981-13-5859-3_7,2018,BRATS
Tumor cell phenotype and heterogeneity differences in IDH1 mutant vs wild-type gliomas,10.1101/690297,2019,BRATS
Expected Exponential Loss for Gaze-Based Video and Volume Ground Truth Annotation,10.1007/978-3-319-67534-3_12,2017,BRATS
Multi-step Cascaded Networks for Brain Tumor Segmentation,10.48550/arxiv.1908.05887,2019,BRATS
A Compound Neural Network for Brain Tumor Segmentation,10.1109/icip.2019.8803040,2019,BRATS
Modified U-Net for Automatic Brain Tumor Regions Segmentation,10.23919/eusipco.2019.8902767,2019,BRATS
A Multi-class Image Classifier for Assisting in Tumor Detection of Brain Using Deep Convolutional Neural Network,10.1007/978-981-13-8969-6_6,2020,BRATS
Mixed-Reality Aided System for Glioblastoma Resection Surgery using Microsoft HoloLens,10.1109/eit.2019.8833738,2019,BRATS
Integrating cross-modality hallucinated MRI with CT to aid mediastinal  lung tumor segmentation,10.48550/arxiv.1909.04542,2019,BRATS
Quantitative Impact of Label Noise on the Quality of Segmentation of Brain Tumors on MRI scans,10.15439/2019f273,2019,BRATS
Combined Learning for Similar Tasks with Domain-Switching Networks,10.1007/978-3-030-32254-0_63,2019,BRATS
A Clinical Measuring Platform for Building the Bridge Across the Quantification of Pathological N-Cells in Medical Imaging for Studies of Disease,10.1007/978-3-030-32689-0_9,2019,BRATS
Finite Difference Method Based Super-Diffusive Model for Benign Brain Tumor Segmentation,10.1109/icmsao.2019.8880394,2019,BRATS
Brain Tumour Segmentation from Multispectral MR Image Data Using Ensemble Learning Methods,10.1007/978-3-030-33904-3_30,2019,BRATS
A Study on Histogram Normalization for Brain Tumour Segmentation from Multispectral MR Image Data,10.1007/978-3-030-33904-3_35,2019,BRATS
Deep learning network with Euclidean similarity factor for Brain MR Tumor segmentation and volume estimation,10.1142/s1793962319500399,2019,BRATS
Computer-aided classification system for early endometrial cancer of co-registered photoacoustic and ultrasonic signals,10.1117/12.2536709,2019,BRATS
Neuroimaging Based Survival Time Prediction of GBM Patients Using CNNs from Small Data,10.1109/smc.2019.8913929,2019,BRATS
Semi-automatic unsupervised MR brain tumour segmentation using a simple Bayesian Framework,10.1080/13682199.2019.1700875,2019,BRATS
Improving Brain Tumor Segmentation with Dilated Pseudo-3D Convolution and Multi-direction Fusion,10.1007/978-3-030-37731-1_59,2020,BRATS
Automatic lesion segmentation and classification of hepatic echinococcosis using a multiscale-feature convolutional neural network,10.1007/s11517-020-02126-8,2020,BRATS
An Enhanced U-Net for Brain Tumor Segmentation,10.1109/robio49542.2019.8961564,2019,BRATS
A simple model for glioma grading based on texture analysis applied to conventional brain MRI,10.1101/2020.01.29.924712,2020,BRATS
A Generalized Densely Connected Encoder-Decoder Network for epithelial and stromal regions segmentation in histopathological images,10.1109/bibm47256.2019.8983357,2019,BRATS
Improved Brain Tumor Segmentation in MRI Images Based on Thermal Analysis Model Using U-Net and GPUs,10.1007/978-3-030-36677-3_10,2019,BRATS
Brain MRI Super-resolution Reconstruction using a Multi-level and Parallel Conv-Deconv Network,10.1109/bibm47256.2019.8983233,2019,BRATS
cuRadiomics: A GPU-Based Radiomics Feature Extraction Toolkit,10.1007/978-3-030-40124-5_5,2019,BRATS
DDU-Nets: Distributed Dense Model for 3D MRI Brain Tumor Segmentation,10.48550/arxiv.2003.01337,2020,BRATS
One-to-one Mapping for Unpaired Image-to-image Translation,10.48550/arxiv.1909.04110,2019,BRATS
Latest Trends in Automatic Glioma Tumor Segmentation and an Improved Convolutional Neural Network based Solution,10.1109/macs48846.2019.9024815,2019,BRATS
A New Multiple Max-pooling Integration Module and Cross Multiscale  Deconvolution Network Based on Image Semantic Segmentation,10.48550/arxiv.2003.11213,2020,BRATS
Brain Tumor Segmentation Based on Deep Learning,10.1109/isacs48493.2019.9068878,2019,BRATS
Semi-supervised Learning Approach to Generate Neuroimaging Modalities with Adversarial Training,10.1007/978-3-030-47436-2_31,2020,BRATS
Evaluation of a deep learning based brain tumour segmentation method,10.1088/1742-6596/1497/1/012009,2020,BRATS
Data Augmentation Using GANs for 3D Applications,10.4018/978-1-5225-5294-9.ch011,2020,BRATS
Improving Brain Tumor Segmentation in Multi-sequence MR Images Using Cross-Sequence MR Image Generation,10.1007/978-3-030-46643-5_3,2019,BRATS
The Tumor Mix-Up in 3D Unet for Glioma Segmentation,10.1007/978-3-030-46643-5_26,2019,BRATS
Overall Survival Prediction Using Conventional MRI Features,10.1007/978-3-030-46643-5_24,2019,BRATS
Annotation-Free Gliomas Segmentation Based on a Few Labeled General Brain Tumor Images,10.1109/isbi45749.2020.9098366,2020,BRATS
